filename,Is Female,Names,Nouns,Organizations,Text,Verbs
IMA_Fungus/PMC5493537.nxml,0.5991983967935872,Steve Miller;Susan Loeb;Todd F. Elliott;Frances Marzitelli;Donna Mitchell,collections,University of Wyoming;US Forest Service,"We thank Steve Miller (University of Wyoming), Susan Loeb (US Forest Service, South Carolina), Todd F. Elliott (North Carolina), Frances Marzitelli (Quebec), and Donna Mitchell (West Virginia) for sharing their fungal collections.",thank;share
IMA_Fungus/PMC5493537.nxml,0.0,Andrew Uccello;Chris Burke;Karrah Kwasnik,fieldwork;help;volunteers,Bartlett Experimental Forest,"Andrew Uccello and Chris Burke assisted in the fieldwork with additional help from Karrah Kwasnik, among other volunteers, at Bartlett Experimental Forest.",assist
IMA_Fungus/PMC5493537.nxml,0.0,Austin Frewert,electron;micrographs;bartlettii;ascospores;studies;scanning;electron;microscope,JEOL,Scanning electron micrographs of  E. bartlettii  ascospores were produced at the N.C. Brown Center for Ultrastructure studies using a JEOL JSM-5800LV scanning electron microscope by Austin Frewert.,scan;produce
IMA_Fungus/PMC5493537.nxml,0.0,Todd F. Elliott,photographs;oreoides;verruculosus, E.,Todd F. Elliott provided photographs of  E. oreoides  and  E. verruculosus.  ,provide
IMA_Fungus/PMC5493537.nxml,0.0,Terry Henkel;Todd F. Elliott,reviewer;comments;manuscript,,"We thank Terry Henkel, Todd F. Elliott, and an anonymous reviewer for comments which improved the manuscript.",thank;improve
IMA_Fungus/PMC5159594.nxml,1.0,Jean Michel Onana,assistance,"The National Herbarium of Cameroon (Institute of Agricultural Research for Development, IRAD","Jean Michel Onana, Head of The National Herbarium of Cameroon (Institute of Agricultural Research for Development, IRAD) provided much logistical assistance.",provide
IMA_Fungus/PMC5159594.nxml,,Mengamenya Goue Achille,staff;fieldwork,the Dja Biosphere Reserve;Dja,"The Conservator of the Dja Biosphere Reserve, Mengamenya Goue Achille, and his staff greatly assisted the fieldwork in the Dja.",assist
IMA_Fungus/PMC5159594.nxml,0.4708994708994709,Alamane Gabriel;Abate Jackson;Mei Lin Chin,Field;assistance,Cameroon;Mamane Jean-Pierre,"Field assistance in Cameroon was provided by Alamane Gabriel (a.k.a. Sikiro), Abate Jackson, Mamane Jean-Pierre, and Mei Lin Chin.",provide
IMA_Fungus/PMC5159594.nxml,0.0,James Trappe,etymology,,James Trappe assisted with the etymology.,assist
IMA_Fungus/PMC5159597.nxml,0.14410480349344978,Stephen Taerum;Joshua Konkol;Miranda Erasmus;Tuan Duong;Masato Torii;Naoto Kamata;Roger Beaver,assistance;fungi;assistance;document;procurement;beetle;identifications,Ching-Shan Lin,"We thank Stephen Taerum and Joshua Konkol for assistance in culturing fungi, Miranda Erasmus and Tuan Duong for taxonomic and phylogenetic assistance, Masato Torii and Naoto Kamata for document procurement, and Ching-Shan Lin and Roger Beaver for beetle identifications.",thank;culture
IMA_Fungus/PMC5159598.nxml,,Lehoo Tedersoo,gratitude;help;phases;project,Institute of Ecology and Earth Sciences;University of Tartu,"We express our gratitude to Lehoo Tedersoo (Institute of Ecology and Earth Sciences, University of Tartu, Tartu, Estonia), for help during the first phases of this project.",express
IMA_Fungus/PMC5493529.nxml,1.0,Anna Łatkiewicz,help;scanning;electron;microscopy,,We thank Anna Łatkiewicz (Kraków) for technical help with scanning electron microscopy.,thank
IMA_Fungus/PMC5493531.nxml,0.0,Laszlo Bartalos;René Jarling;Camarosporium  ,specimens;taxa;study,,We acknowledge Laszlo Bartalos and René Jarling for sending us specimens of  Camarosporium  and similar taxa examined in the present study.,acknowledge;send;examine
IMA_Fungus/PMC5493531.nxml,0.0,René K. Schumacher,collections;study;problem;nomenclature;attention, Camarosporium  ,"We are also thankful to René K. Schumacher for making many valuable collections available to be included in this study, and for bringing the problem related to the nomenclature of  Camarosporium  to our attention.",make;include;bring;relate
IMA_Fungus/PMC5493539.nxml,0.5,Konstanze Bensch;David L. Hawksworth,comments;suggestions;manuscript,,We also thank Konstanze Bensch and David L. Hawksworth for the valuable comments and suggestions to improve the manuscript.,thank;improve
IMA_Fungus/PMC5493539.nxml,0.6485849056603773,Eliane Silva-Nogueira;Luan Amim;Marjan Vermaas;Arien van Iperen;Mieke Starink-Willemse,thanks;staff,the Universidade Federal de Pernambuco;the Westerdijk Fungal Biodiversity Institute,"We extend our thanks to the Universidade Federal de Pernambuco and to the technical staff, Eliane Silva-Nogueira and Luan Amim from the URM Culture Collection, and to Marjan Vermaas, Arien van Iperen and Mieke Starink-Willemse from the Westerdijk Fungal Biodiversity Institute.",extend
IMA_Fungus/PMC5493539.nxml,1.0,Tamara Caldas;Greicilene Albuquerque,students;UFPE;help;processing;samples,Karla Freire;the Laboratório de Micologia Ambiental,"We also thank Tamara Caldas, Greicilene Albuquerque, Gianne Rizzuto, Karla Freire and other students of the Laboratório de Micologia Ambiental/UFPE for their technical help and processing of samples.",thank
IMA_Fungus/PMC5493540.nxml,0.5,Scott A. Redhead;Olga Koppel,advice;translation;DAOM;specimen;label,,We are grateful to Scott A. Redhead for nomenclatural advice and to Olga Koppel for Russian translation of the DAOM 210103 specimen label.,
IMA_Fungus/PMC5493540.nxml,0.0,Keith A. Seifert,group;DNA;sequencing;comments;manuscript,JBT;the Microbiology Molecular Technologies Laboratory;MMTL,"JBT is grateful to the Microbiology Molecular Technologies Laboratory (MMTL) group of ORDC-AAFC, Ottawa, for processing DNA sequencing, and Keith A. Seifert for his comments on this manuscript.",process
IMA_Fungus/PMC5729717.nxml,0.3590664272890485,Yilmaz Balci;Zia Banihashemi;Lien Bertier;Karien Bezuidenhout;Clive Brasier;Mike Coffey,authorities;originators;study, Phytophthora  ,"We would like to thank all authorities and species originators who provided  Phytophthora  isolates to our study, including Yilmaz Balci, Zia Banihashemi, Lien Bertier, Karien Bezuidenhout, Clive Brasier, Treena Burgess, Mike Coffey,",like;thank;speci;provide;isolate;include
IMA_Fungus/PMC5729717.nxml,0.33924769339957417,Mannon Gallegly;Beatrice Ginetti;Niklaus Grünwald;Everett Hansen;Beatrice Henricot;Fredrik Heyman;Hon Ho;Maria Holeva;Steven Jeffers;Thomas Jung;Koji Kageyama;Willem Man;Jan Nechwatal;Bruno Scanu;Andrea Vannini;Anna Maria Vettraino,t,Irene Vloutoglou,"Mannon Gallegly, Beatrice Ginetti, Niklaus Grünwald, Everett Hansen, Beatrice Henricot, Fredrik Heyman, Hon Ho, Maria Holeva, Steven Jeffers, Thomas Jung, Koji Kageyama, Willem Man in 't Veld, Jan Nechwatal, Bruno Scanu, Andrea Vannini, Anna Maria Vettraino, and Irene Vloutoglou.",
IMA_Fungus/PMC5729712.nxml,,GuoQing Li;FeiFei Liu;MiRu Zhang,authors;assistance;samples,,"The authors thank GuoQing Li, FeiFei Liu, and MiRu Zhang for their assistance in collecting samples.",thank;collect
IMA_Fungus/PMC5729713.nxml,1.0,Jean Michel Onana,assistance,"The National Herbarium of Cameroon (Institute of Agricultural Research for Development, IRAD","Jean Michel Onana, former Head of The National Herbarium of Cameroon (Institute of Agricultural Research for Development, IRAD), provided much logistical assistance.",provide
IMA_Fungus/PMC5729713.nxml,,Mengamenya Goue Achille,Conservators;staff;fieldwork,Ndinga Hillaire;Dja,"The Conservators of the Dja Biosphere Reserve, Mengamenya Goue Achille and Ndinga Hillaire and their staff greatly assisted the fieldwork in the Dja.",assist
IMA_Fungus/PMC5729713.nxml,0.0,Alamane Gabriel;Abate Jackson;Essambe Jean-Pierre,Field;assistance,Cameroon,"Field assistance in Cameroon was provided by Alamane Gabriel (a.k.a. Sikiro), Abate Jackson, Essambe Jean-Pierre (a.k.a.",provide
IMA_Fungus/PMC5729713.nxml,0.6539792387543253,Mei Lin Chin;Carolyn Delevich;Todd Elliott;Jumbam Blaise,Papa,Papa Chef;Sylvain Kentsap;Camille Truong,"Papa Chef), Mei Lin Chin, Carolyn Delevich, Todd Elliott, Sylvain Kentsap, Jumbam Blaise, and Camille Truong.",
IMA_Fungus/PMC5729713.nxml,1.0,Alicia Hobbs;Rachel Koch;Elena Karlsen-Ayala,laboratory;assistance,the University of Tennessee;Purdue University,Valuable laboratory assistance was provided by Alicia Hobbs at the University of Tennessee and Rachel Koch and Elena Karlsen-Ayala at Purdue University.,provide
IMA_Fungus/PMC5729714.nxml,,Ed Whitfield;Kalima Mwange,isolations;house;dust;samples,,We would like to acknowledge Ed Whitfield and Kalima Mwange who made all isolations from house dust samples.,like;acknowledge
IMA_Fungus/PMC5729715.nxml,0.5988023952095809,Arien Van Iperen;Mieke Starink-Willemse,assistance;experience;citrus;diseases;contribution;pathogenicity;tests,"Di3A, University of Catania","We are grateful to Arien Van Iperen and Mieke Starink-Willemse for technical assistance, and would like to thank Giancarlo Polizzi (Di3A, University of Catania) for sharing his experience in citrus diseases, and for his kind contribution in performing pathogenicity tests.",like;thank;share;perform
IMA_Fungus/PMC5729716.nxml,0.0,Walter Gams,manuscript;colleague;mycologist;contributions;taxonomy;nomenclature;fungi;work,,This manuscript is dedicated to our colleague and esteemed mycologist Walter Gams (1934-2017) whose contributions to taxonomy and nomenclature of fungi made this work possible.,dedicate;esteem
IMA_Fungus/PMC5729716.nxml,0.0,Ryan Woolverton;Shenghua Wu,individuals;contribution;manuscript;jian;members,the Japan Society for Vegetable Wasps,"We would like to acknowledge the following individuals for their contribution to this manuscript: Ryan Woolverton, Yi-jian Yao, Shenghua Wu, and also members of the Japan Society for Vegetable Wasps and Plant Worms.",like;acknowledge;follow
IMA_Fungus/PMC6048572.nxml,0.0,Juan Carlos Zamora,comments;manuscript,,Juan Carlos Zamora is gratefully acknowledged for helpful comments on the manuscript.,acknowledge
IMA_Fungus/PMC6048562.nxml,0.0,David Hawksworth,curators;investigation;specimens;keeping;information;salweyi;types;fungarium;corrections,TUB;Tübingen; Ustilago,"We are grateful to the curators of B (Berlin), GLM (Görlitz), M (Munich), and TUB (Tübingen) for allowing the investigation of specimens in their keeping, and David Hawksworth for important information on  Ustilago salweyi  types in K-M (Kew fungarium) and nomenclatural corrections.",allow
IMA_Fungus/PMC6048562.nxml,0.0,Horst Jage;Volker Kummer,collectors;collections;study,,We thank the private collectors Horst Jage and Volker Kummer for allowing us to include some of their collections in this study.,thank;allow;include
IMA_Fungus/PMC6048562.nxml,,Bagdevi Mishra,opportunity;thines-lab@senckenberg.de/trease;analysis,,We want to thank Bagdevi Mishra for the opportunity to use TrEase ( thines-lab@senckenberg.de/trease ) for phylogenetic analysis.,want;thank;use
IMA_Fungus/PMC6048562.nxml,0.0,Reuel Bennett,help;primer;design;primer;proof;draft;manuscript,,"Furthermore, we are grateful to Y.-J. Choi for help with the primer design for an internal ITS primer and to Reuel Bennett for proof-reading an initial draft of the manuscript.",read
IMA_Fungus/PMC6048566.nxml,0.0,Paul M. Kirk;Conrad L. Schoch;Fungorum  ,data, Index;GenBank,"We are indepted to Paul M. Kirk and Conrad L. Schoch for providing data from  Index Fungorum  and GenBank, respectively.",indept;provide
IMA_Fungus/PMC6048566.nxml,0.0,Travis Adkins,culture;numbers;NRRL,,Travis Adkins kindly supplied fungal culture numbers for the NRRL.,
IMA_Fungus/PMC6048566.nxml,0.0,Daniel Lindner,data;study;variation;sulphureus,,Daniel Lindner is thanked for providing raw data from the study on intragenomic ITS variation in  Laetiporus sulphureus .,thank;provide
IMA_Fungus/PMC6048566.nxml,0.17704426106526633,Catherine Aime;Takayuki Aoki;Lei Cai;Pedro Crous;Wilhelm DeBeer;David Geiser;Peter Johnston;Tom May;Andrew Miller;Conrad Schoch;Marco Thines;Keith Seifert;Marc Stadler;Ning Zhang,members;discussions;subject;text;boxes,the International Commission;the Taxonomy of Fungi;ICTF,"The members of the International Commission on the Taxonomy of Fungi (ICTF), including Catherine Aime, Takayuki Aoki, Lei Cai, Pedro Crous, Wilhelm DeBeer, David Geiser, Peter Johnston, Tom May, Andrew Miller, Conrad Schoch, Marco Thines, Keith Seifert, Marc Stadler, and Ning Zhang, engaged in fruitful discussions on the subject (referred to in the text or the boxes).",include;engage;refer
IMA_Fungus/PMC6048566.nxml,0.0,Conrad Schoch,reviewers;comments;manuscript,,Conrad Schoch and two anonymous reviewers provided valuable comments that helped to improve this manuscript.,provide;help;improve
IMA_Fungus/PMC6048569.nxml,1.0,Angela Conti,authors;help,,The authors acknowledge gratefully Angela Conti for friendly technical help.,acknowledge
IMA_Fungus/PMC6048570.nxml,,Gaddam Bagyanarayana;Cvetomir Denchev;David McLaughlin;Alistair McTaggart;Drew Minnis;Franz Oberwinkler;Angela Schäfer;Roger Shivas;John Wiersema;Andrey Yurkov,individuals;input;discussions;suggestions,,"We are extremely grateful to the following individuals for their input, discussions, and suggestions: Gaddam Bagyanarayana, Cvetomir Denchev, David McLaughlin, Alistair McTaggart, Drew Minnis, Franz Oberwinkler ( † ), Angela Schäfer, Roger Shivas, John Wiersema, and Andrey Yurkov.",follow
IMA_Fungus/PMC6048573.nxml,0.7512562814070352,Gail Doehring;Nathane Orwig;Amy McGovern;Jennifer Teresi;Ahmed M. Nhmoud,assistance;aspects;study,,"We are pleased to acknowledge the skilled technical assistance of Gail Doehring, Nathane Orwig, Amy McGovern, Jennifer Teresi, and Ahmed M. Nhmoud in various aspects of this study.",acknowledge
IMA_Fungus/PMC6048573.nxml,0.0,Gert H.J. Kema,Gert;research,Wageningen Plant Research,Gert H.J. Kema (Wageningen Plant Research) is acknowledged for initiating the research reported here.,acknowledge;initiate;report
IMA_Fungus/PMC6048571.nxml,,CAS 153211KYSB20160029,work;PhD;project;research,University of Siena;L.P.;Chinese Academy of Sciences,"The experimental work was performed at University of Siena as part of the PhD project of L.P., who also acknowledges CAS 153211KYSB20160029 for supporting his research at Chinese Academy of Sciences.",perform;acknowledge;support
IMA_Fungus/PMC6048574.nxml,0.5535714285714286,Shannon Dominick;Lee Davis,loan;specimens;care,Markéta Šandová;BPI,"We are grateful to Markéta Šandová (PRM), Shannon Dominick (BPI) and Lee Davis (K(M)) for the loan of specimens in their care.",
IMA_Fungus/PMC6048574.nxml,0.39959839357429716,Ivana Borovičková;Alena Kubátová;Orlando Cáceres;Lukáš Janošík;Petr Zehnálek,assistance;data;preparation;specimens;electron;microscopy;assistance;field,,"We also thank Ivana Borovičková for technical assistance in obtaining the molecular data, and Alena Kubátová for preparation of specimens for electron microscopy, as well as Orlando Cáceres, Lukáš Janošík and Petr Zehnálek for assistance in the field.",thank;obtain
IMA_Fungus/PMC6048574.nxml,0.0,Magzoub Ismail;Michael Manning;Kamash Ramanathan,,G.D.,"G.D. also acknowledges Magzoub Ismail, Michael Manning and Kamash Ramanathan",acknowledge
IMA_J_Appl_Math/PMC4816497.nxml,,R. W. Ogden;C. McComb;H. M. Wang,authors;discussions;imaging;data;subject;implementation;model,,"The authors acknowledge useful discussions with R. W. Ogden, FRS, C. McComb, who assisted in acquiring the imaging data for the healthy subject, and H. M. Wang, who developed the initial implementation of the ABAQUS-based LV model.",acknowledge;assist;acquire;develop;base
IMA_J_Appl_Math/PMC4816497.nxml,,Xeon X5650,simulations;servers;core;GHz;CPUs;RAM,the School of Mathematics and Statistics;the University of Glasgow;Linux;Intel,All simulations were performed at the School of Mathematics and Statistics at the University of Glasgow using Linux servers with dual six-core Intel Xeon X5650 2.67 GHz CPUs and 32 GB RAM.,perform
IMA_J_Appl_Math/PMC4975073.nxml,0.0,Peter Constantin;Avram Holmes;Nathan Kutz;Michael Mueller;Eric Shea-Brown,advice,,"We thank Peter Constantin, Avram Holmes, Nathan Kutz, Michael Mueller and Eric Shea-Brown for advice.",thank
ISME_J/PMC4303625.nxml,0.0,Alastair Bewsher,help;data,IC,We thank Alastair Bewsher for his help with the IC data.,thank
ISME_J/PMC2713796.nxml,,E. Chang,HD043839;HD,,HD043839 and HD 059123(to E. Claud) and DK047722 and HG4858 (to E. Chang).,
ISME_J/PMC2764841.nxml,0.0,Rolf A. Olsen;Ian Hodkinson;Steve Coulson,field;research;information;locations;discussions,the University Centre,"We thank Dr. Rolf A. Olsen and the University Centre in Svalbard (UNIS) for facilitating our field research, and Dr. Ian Hodkinson and Dr. Steve Coulson for information on their sampling locations and valuable discussions.",thank;facilitate;sample
ISME_J/PMC2764841.nxml,0.25,Eva Top;Richard Pendegraft;Matthias Zielke;Stefano Ventura,advice;methods;isolation;help;analyses;assistance;field,,"We also wish to acknowledge Dr. Eva Top for advice on methods for DNA isolation, Richard Pendegraft for help with statistical analyses, and Dr. Matthias Zielke, Dr. Stefano Ventura and Silvia Turichia for their assistance in the field.",wish;acknowledge
ISME_J/PMC2764841.nxml,0.0,Patrick Kuss,comments;manuscript,,"Finally, we appreciate the helpful comments on the manuscript provided by Dr. Kari Segraves and Dr. Patrick Kuss.",appreciate;provide
ISME_J/PMC2749086.nxml,0.0,William Fenical,manuscript;work;metabolites;actinomycetes,,This manuscript is dedicated to Professor William Fenical for his pioneering work on the secondary metabolites of marine actinomycetes.,dedicate
ISME_J/PMC2749086.nxml,0.0,Jonathan Badger;Terry Gaasterland,assistance;assistance,APIS,We acknowledge Dr. Jonathan Badger for assistance with APIS and Prof. Terry Gaasterland for computational assistance.,acknowledge
ISME_J/PMC2808446.nxml,0.6666666666666666,Chike V. Anadumaka;Mary Beth Leigh;Martina Mackova,assistance;work;rhizosphere;site;biodegradation;studies,Ondrej Uhlik,"We thank Chike V. Anadumaka for technical assistance, and acknowledge the important work by Mary Beth Leigh, Martina Mackova, Tomas Macek, and Ondrej Uhlik, which established this rhizosphere site as important for aromatic biodegradation studies.",thank;acknowledge;establish
ISME_J/PMC2797552.nxml,0.1694915254237288,Ruth Ley;Noah Fierer;Brian Muegge;Jesse Stombaugh;Daniel McDonald;Christian Lauber,feedback;manuscript,,"We thank Jeffrey I Gordon, Ruth Ley, Noah Fierer, Brian Muegge, Jesse Stombaugh, Daniel McDonald, and Christian Lauber for valuable feedback on the manuscript.",thank
ISME_J/PMC3105771.nxml,0.0,David Harris,members;sequencing;team;sequences,the Wellcome Trust Sanger Institute,We thank David Harris and members of the sequencing team at the Wellcome Trust Sanger Institute for generating the sequences.,thank;generate
ISME_J/PMC3105769.nxml,0.0,Jan Kok;Rijksuniversiteit Groningen; L.,authors;strain;lactis,,The authors would like to thank Professor Jan Kok from the Rijksuniversiteit Groningen for kindly supplying strain  L. lactis  MG610.,like;thank;supply
ISME_J/PMC3105769.nxml,0.0,Filipe Santos,discussions,,We would also like to thank Bas Teusink and Filipe Santos for fruitful discussions.,like;thank
ISME_J/PMC3160684.nxml,,F Prahl;B Popp of UH,acknowledgement;cruise,OCE 0726422;RAF,A special acknowledgement to Dr F Prahl and Dr A White of OSU (OCE 0726422) and Dr B Popp of UH for inviting and sponsoring RAF on the cruise to Gulf of California.,invite;sponsor
ISME_J/PMC3160684.nxml,,J Montoya;D Karl,suggestions;advice;data;processing;suggestions;manuscript;preparation,RAF;JPZ,RAF and JPZ recognize the helpful suggestions and advice by J Montoya and C Mahaffey in the data processing and D Karl for his helpful suggestions on our manuscript preparation.,recognize
ISME_J/PMC3160686.nxml,0.49489795918367346,Geoff A Codd;Marion Meima,microcystin;standards;support;reviewers;comments;manuscript,,"We thank Geoff A Codd for the microcystin gravimetrical standards, Marion Meima for technical support with the quantitative PCR, and the reviewers for their helpful comments on the manuscript.",thank
ISME_J/PMC3309351.nxml,0.742857142857143,Mitchell Sogin;Linda Amaral-Zettler;Hilary Morrison;Katerina Andreishcheva,assistance;tag;sequencing,,"We thank Mitchell Sogin, Linda Amaral-Zettler, Hilary Morrison and Katerina Andreishcheva at the MBL (Woods Hole) for their assistance with 454 massively parallel tag sequencing.",thank
ISME_J/PMC3309351.nxml,1.0,Sue Huse;Lucie Zinger,help;calculation;OTU;richness;estimates,,Sue Huse and Lucie Zinger are acknowledged for their help with the calculation of OTU richness estimates.,acknowledge
ISME_J/PMC3400417.nxml,0.0,Christopher Quince;Anders Andersson;Gabriel Singer;Michael Forisch,help;data;analysis,the Computational Systems Biology Department,"We thank Christopher Quince, Anders Andersson, Gabriel Singer, Michael Forisch and the Computational Systems Biology Department for their help with data analysis.",thank
ISME_J/PMC3400407.nxml,0.1452991452991453,Richard Beam;Garth Didlick;William Heston;Dee Putzier;Doug Spencer;Rodney Waage,assistance;hospital,,"We thank Richard Beam, Garth Didlick, William Heston, Dee Putzier, Doug Spencer and Rodney Waage for logistical assistance at the hospital.",thank
ISME_J/PMC3400407.nxml,0.25125628140703515,Colin Bohannan;Adam Burns;Ed Clark;Mitzi Liu;Gwynhwyfer Mhuireach;Tim O'Connor,assistance;sample;collection;processing,,"We thank Colin Bohannan, Adam Burns, Ed Clark, Mitzi Liu, Gwynhwyfer Mhuireach and Tim O'Connor for assistance with sample collection and processing.",thank
ISME_J/PMC3400413.nxml,0.5025125628140703,Aurelie Breton;Joshua Quick,project;agreement;donation;soil;samples;instrument,the National Ecological Observatory Network;the National Science Foundation,"We wish to thank the National Ecological Observatory Network (a project sponsored by the National Science Foundation and managed under cooperative agreement by NEON, Inc.) for donation of the soil samples; and Aurelie Breton and Joshua Quick for running the MiSeq instrument.",wish;thank;sponsor;manage;run
ISME_J/PMC3504957.nxml,0.0,Luke Winslow,buoy;support;carbon;dioxide;sensor,,"We thank Luke Winslow for buoy support, especially with the carbon dioxide sensor.",thank
ISME_J/PMC3504957.nxml,,J Handelsman;H Goodrich-Blair,comments;versions;work,AR Ives;MA Moran,"We thank YS Dufour, AR Ives, J Handelsman, H Goodrich-Blair, MA Moran and P Weimer for comments on earlier versions of this work.",thank
ISME_J/PMC3504957.nxml,1.0,Betty Moore Foundation Fellow,,AS;the Life Sciences Research Foundation,AS is a Gordon and Betty Moore Foundation Fellow of the Life Sciences Research Foundation.,
ISME_J/PMC3504966.nxml,0.4736842105263158,Alexander Galushko;Jasmin Schwarz,support,,"Alexander Galushko, Jasmin Schwarz and Martina Grill are acknowledged for technical support.",acknowledge
ISME_J/PMC3504966.nxml,1.0,Galina Streshiskaya,peptidoglycan;analyses,,We thank Galina Streshiskaya for peptidoglycan analyses.,thank
ISME_J/PMC3260500.nxml,1.0,KR Clarke;Margaret Hughes,expertize;modelling;support,,"We would like to thank Dr KR Clarke for providing extensive expertize in statistical modelling, and Margaret Hughes for providing the pyrosequencing technical support.",like;thank;provide;provide
ISME_J/PMC3260511.nxml,0.5110732538330494,Alex Krusche;Telma A Monezi;Jonismar Souza;Alice Plaskievicz;Anthony Lopes;Patricia Garrafa;Bernardo Gimenes,support;support;help;sample;collection;processing,USP;ICB;INPA;ICB,"We thank Alex Krusche (CENA, USP) for the logistical support, Telma A Monezi (ICB-USP) for technical support, Jonismar Souza, Alice Plaskievicz and Anthony Lopes (INPA), and Patricia Garrafa and Bernardo Gimenes (ICB—USP) for the valuable help during the sample collection and processing.",thank
ISME_J/PMC3260511.nxml,0.49874686716791977,Jérôme Payet;Matthias Fischer;Jessica Labonté;Amy Chan,assistance;protocols;techniques;project,Caroline Chénard;EOS-UBC,"We also thank Jérôme Payet, Caroline Chénard, Matthias Fischer, Jessica Labonté and Amy Chan (EOS-UBC) for their priceless assistance with specific protocols and techniques involved in the project.",thank;involve
ISME_J/PMC3246230.nxml,0.0,Paul Verburg;Jay Arnone;Jay Cullen;Paul Falkowski,input,,"We thank Paul Verburg, Jay Arnone, Jay Cullen and Paul Falkowski for providing input.",thank;provide
ISME_J/PMC3246230.nxml,0.6677852348993288,Sara Jenkins;Lisa Wable;Ken McGuire,assistance;figures,GIS,"We thank Sara Jenkins, Lisa Wable and Ken McGuire for assistance with figures and GIS.",thank
ISME_J/PMC3246230.nxml,0.0,Roger Kreidberg,editing;manuscript,,Roger Kreidberg is gratefully acknowledged for critical editing of the manuscript.,acknowledge
ISME_J/PMC3379640.nxml,0.0,David Ginsburg;Philipp Rausch;Ateequr Rehman;Srivinasa Murthy,assistance;mice;discussions;assistance;data;analysis;assistance,the  B4galnt2 −/−  ,"We wish to thank David Ginsburg for his assistance with the  B4galnt2 −/−  mice, Philipp Rausch, Ateequr Rehman and Sri Girish Srivinasa Murthy for helpful discussions and assistance in data analysis, and Silke Carstensen for excellent technical assistance.",wish;thank
ISME_J/PMC3379637.nxml,0.4,Cyndi Pfannkoch;Daniel Brami;Brian Palenik;Lihini Aluwihare;Shibu Yooseph,effort;library;construction;assembly;insight;discussion,,"We thank Cyndi Pfannkoch for effort on library construction; Daniel Brami for assembly insight; Brian Palenik, Lihini Aluwihare and Shibu Yooseph for insightful discussion.",thank
ISME_J/PMC3280140.nxml,1.0,Anna Peterson;Ana Lisette Arellano,assistance;field,,"We thank Anna Peterson, Ana Lisette Arellano and August Jensen for assistance in the field.",thank
ISME_J/PMC3280140.nxml,1.0,Donna Berg-Lyons,assistance;samples,,We thank Donna Berg-Lyons for assistance in preparing samples for pyrosequencing.,thank;prepare;pyrosequenc
