filename,Is Female,Names,Nouns,Organizations,Text,Verbs
20_Century_Br_Hist/PMC4804230.nxml,0.0,Mathew Thomson,author;reviewers;comments;drafts;article,,"The author would like to sincerely thank the anonymous reviewers, as well as Dr. Mathew Thomson, for their insightful comments on earlier drafts of this article.",like;thank
20_Century_Br_Hist/PMC5905639.nxml,0.0,Mathew Thomson,co;investigator;members;team;comments;insight,,I would like to thank my co-investigator Mathew Thomson and all members of the team for their comments and insight.,like;thank
3D_Print_Med/PMC5954789.nxml,,Diya Ma;Matthew-Lun Wong;Jin-Peng Lee,authors;contributions;software;development,,"The authors wish to acknowledge Diya Ma, Matthew-Lun Wong, Ka-Long Ko, Ka-Hei Ko and Jin-Peng Lee for their important contributions to the software development.",wish;acknowledge
3D_Print_Med/PMC5954790.nxml,1.0,Clarice Smith;Abigail van Buren;Corinne Schuler,support,the Robert Wood Johnson Foundation;Marvin Dekelboum Family Foundation;The Liston Family Foundation;the Robert H.;Disease Research Program;The GHR Foundation;Foundation;the Mayo Foundation,"Additional support was provided by the Robert Wood Johnson Foundation, The Elsie and Marvin Dekelboum Family Foundation, The Liston Family Foundation, the Robert H. and Clarice Smith and Abigail van Buren Alzheimer’s Disease Research Program, The GHR Foundation, Foundation Dr. Corinne Schuler (Geneva, Switzerland), and the Mayo Foundation.",provide
3D_Print_Med/PMC5954792.nxml,0.0,Michel Vong,authors;help;operation;printing;video;recording;editing,the University of Edinburgh,The authors would like to thank Michel Vong of the University of Edinburgh for his help and support in the operation of the 3D printing and video recording/editing.,like;thank;support
3D_Print_Med/PMC5954794.nxml,,Dinghau Huang;Pi-Hsia Liu,authors;arrangement;participants;orthosis;design;exercise;advice;interviews,Ming Chi University of Technology;the Chang Gung University of Science and Technology,"The authors would like to thank Dr. Dinghau Huang of Ming Chi University of Technology and Prof. Pi-Hsia Liu of the Chang Gung University of Science and Technology for their arrangement for voluntary participants in the orthosis design exercise, and great advice concerning the interviews.",like;thank;concern
3D_Print_Med/PMC5954795.nxml,0.0,Alexandre Colello Bruno;Agnelo Bastos;Clésio Fernandes;Carlos Renato;Lourenço Rocha;Sérgio Bueno,contribution;support,,"Alexandre Colello Bruno for intellectual contribution, Agnelo Bastos, Clésio Fernandes, Carlos Renato, Lourenço Rocha and Sérgio Bueno for technical support.",
3D_Print_Med/PMC5954797.nxml,,Data Analysis,SL;Study;design;manuscript;revision;manuscript,Data Acquisition;Critical,"SL: Study design, Data Acquisition, Data Analysis, Drafting of manuscript, Critical revision of the manuscript.",
3D_Print_Med/PMC5954799.nxml,0.0,Dustin Makin,authors;support;3D;process,CreateCafe;Saskatoon,"The authors would like to thank Dustin Makin, CreateCafe, Saskatoon for the technical support during the 3D-printing process.",like;thank;print
3D_Print_Med/PMC6036663.nxml,,Hand Surgeon,IT,CLINICA ARS MEDICA;Gravesano-Lugano,"IT: Hand Surgeon, CLINICA ARS MEDICA, Gravesano-Lugano, CH.",
3D_Print_Med/PMC6036663.nxml,,Trauma Surgeon,VILLA;replicas;fractures;surgery,VILLA STUART;FIFA MEDICAL CENTER PRIVATE CLINIC In Roma,"Orthopaedic and Trauma Surgeon, in VILLA STUART, FIFA MEDICAL CENTER PRIVATE CLINIC In Roma, uses the 3d replicas of articular fractures for percutaneous surgery.",use
3D_Print_Med/PMC6036666.nxml,0.0,Thomas Vrieze;Kris Nunez,authors;assistance;data;acquisition;assistance;manuscript;preparation,,"The authors would like to thank Thomas Vrieze for assistance in phantom data acquisition, and Kris Nunez for assistance in manuscript preparation.",like;thank
3D_Print_Med/PMC6036666.nxml,,Data Analysis,Study;design;manuscript;revision;manuscript,Data Acquisition;Critical,"Study design, Data Acquisition, Data Analysis, Drafting of manuscript, Critical revision of the manuscript.",
3D_Print_Med/PMC6036666.nxml,,Data Analysis,Study;design;revision;manuscript,Data Acquisition;Critical,"Study design, Data Acquisition, Data Analysis, Critical revision of the manuscript.",
3D_Print_Med/PMC6036666.nxml,,Data Analysis,SL;Study;design;manuscript;revision;manuscript,Data Acquisition;Critical,"SL: Study design, Data Acquisition, Data Analysis, Drafting of manuscript, Critical revision of the manuscript.",
3D_Print_Med/PMC6036764.nxml,0.49748743718592964,Bill Mohler;Sara Crittenden,embryo;dataset;dataset;tip;cell,the University of Connecticut;the University of Wisconsin,These include Dr. Bill Mohler from the University of Connecticut at Farmington for the  C. elegans  embryo dataset and Dr. Sara Crittenden at the University of Wisconsin at Madison for the dataset of the distal tip cell.,include;elegan
3D_Print_Med/PMC6036601.nxml,,Teng Zhang;Matthew-Lun Wong;Lily Ma;Jin-Peng Lee;Nicholas K.W. Kwok;Jack Chun-Yiu Cheng,authors;import;contributions;software;development;advices;discussions,Winnie Chiu-Wing Chu,"The authors wish to acknowledge Teng Zhang, Matthew-Lun Wong, Ka-Long Ko, Ka-Hei Ko, Lily Ma, Jin-Peng Lee for their import contributions to the software development, and Nicholas K.W. Kwok, Winnie Chiu-Wing Chu, Jack Chun-Yiu Cheng for their great advices and helpful discussions.",wish;acknowledge
3D_Print_Med/PMC6036610.nxml,0.0,Amir Imanzadeh,authors;contribution;data;collection;preparation;manuscript,,The authors would like to thank Drs Bohdan Pomahac and Amir Imanzadeh for their invaluable contribution in data collection and in preparation of the manuscript.,like;thank
3_Biotech/PMC3339611.nxml,0.4565217391304348,Rup Lal;Jawaharlal Nehru University;Preeti Srivastava,clone;help;CD;experiments;comments;manuscript,Delhi University;Advanced Instrumentation Research Facility,"We thank Prof. Rup Lal of Delhi University for providing the  linA1 -B90 clone, Advanced Instrumentation Research Facility, Jawaharlal Nehru University, New Delhi, for help with CD experiments, and Dr. Preeti Srivastava of IITR, Lucknow, for comments on the manuscript.",thank;provide
3_Biotech/PMC3339590.nxml,,S.K. Sinha,assistance,Department of Biochemistry,"We thank Dr. S.K. Sinha, Department of Biochemistry for expert technical assistance.",thank
3_Biotech/PMC3339585.nxml,1.0,Smriti Shrivastava,,CSIR for Senior Research Fellowship,Smriti Shrivastava is thankful to CSIR for Senior Research Fellowship (,
3_Biotech/PMC3339604.nxml,,K. Ravikumar;R. Murugan,Authors;botanists;authentication;plant;samples;discussion,FRLHT,"Authors wish to thank Dr. K. Ravikumar and Mr. R. Murugan, botanists of FRLHT for authentication of plant samples and useful discussion.",wish;thank
3_Biotech/PMC3339604.nxml,,K.V. Krishnamurthy,Thanks;suggestions;manuscript,,Thanks are due to Prof. K.V. Krishnamurthy for his suggestions in preparing this manuscript.,prepare
3_Biotech/PMC3339612.nxml,1.0,Rosnah Mustafa,authors;comments;paper,,The authors wish to thank Rosnah Mustafa for her comments on the paper.,wish;thank
3_Biotech/PMC3339620.nxml,,Bijender Kumar Bajaj,,"the Department of Science and Technology;Ministry of Science and Technology, Govt","Dr. Bijender Kumar Bajaj gratefully acknowledges the Department of Science and Technology, Ministry of Science and Technology, Govt.",acknowledge
3_Biotech/PMC3339620.nxml,0.0,Yash P. Sharma;Yash P. Khajuria;Post Doctoral Fellow,fungus,University of Jammu;National Institute of Plant Genome Research,"Yash P. Sharma, Department of Botany, University of Jammu, and Dr. Yash P. Khajuria, Post Doctoral Fellow, National Institute of Plant Genome Research, New Delhi, are acknowledged for helping identify the fungus.",acknowledge;help;identify
3_Biotech/PMC3339618.nxml,0.0,Roy H. Doi;Volker Fischer,authors;gratitude;kind;donation;cellulovorans;constructs;thanks;yields;sugar;beet,the University of California (USA; C.,"The authors would like to express their gratitude to Professor Roy H. Doi from the University of California (USA) for the kind donation of the  C. cellulovorans  plasmid constructs, and thanks to Dr Volker Fischer from Agro-yields, South Africa, for kindly providing the sugar beet.",like;express;provide
3_Biotech/PMC3339608.nxml,,T. S. Lokeswari;K. K. Kumar,help;suggestions;course;work;manuscript;preparation,,The help of Dr. T. S. Lokeswari and Dr. K. K. Kumar for their valuable suggestions during the entire course of work and in manuscript preparation is acknowledged.,acknowledge
3_Biotech/PMC3339608.nxml,0.0,Samuel S. Gnanamanickam,authors;help;lab;facilities;house;facility;work,Dr. Ajay Parida,The authors gratefully acknowledge the timely help from Dr. Samuel S. Gnanamanickam and Dr. Ajay Parida for providing lab facilities and green house facility for part of the work.,acknowledge;provide
3_Biotech/PMC3339622.nxml,1.0,Deborah Stenzel,assistance;electron;microscopy,,"We thank Dr Deborah Stenzel, QUT, for assistance in electron microscopy.",thank
3_Biotech/PMC3339622.nxml,0.0,Christopher D. Ogg,recipient,Griffith University’s Australian Post-Graduate Research Award (APRA,Christopher D. Ogg is a recipient of Griffith University’s Australian Post-Graduate Research Award (APRA).,
3_Biotech/PMC3339603.nxml,0.0,Gaurav Sablok,,,Gaurav Sablok,
3_Biotech/PMC3339603.nxml,0.5714285714285714,Jennifer Ann Harikrishna;Lee Wan Sin,facilities,"the Centre for Research in Biotechnology for Agriculture (CEBAR;Genetics;Molecular Biology Division;Institute of Biological Sciences;Faculty of Science, University of Malaya","Jennifer Ann Harikrishna and Lee Wan Sin thank the Centre for Research in Biotechnology for Agriculture (CEBAR) and the Genetics and Molecular Biology Division, Institute of Biological Sciences, Faculty of Science, University of Malaya, Kuala Lumpur, Malaysia for providing computational facilities.",thank;provide
3_Biotech/PMC3339607.nxml,,Bijender Kumar Bajaj,thanks,"the Department of Science and Technology, Ministry of Science and Technology, Govt","Dr. Bijender Kumar Bajaj thanks the Department of Science and Technology, Ministry of Science and Technology, Govt.",
3_Biotech/PMC3482451.nxml,,A.S. Bawa,authors;guidance;encouragement,"Defence Food Research
Laboratory","The authors are grateful to Dr. A.S. Bawa, Director, Defence Food Research
Laboratory, Mysore, for providing constant guidance and encouragement.",provide
3_Biotech/PMC3482448.nxml,1.0,Laura Cox,advice,the Texas Biomedical Research Institute,The advice of Dr Laura Cox of the Texas Biomedical Research Institute is gratefully acknowledged.,acknowledge
3_Biotech/PMC3482444.nxml,0.0,Jayesh Bellare,authors;facilities;surface;area;measurement;analysis;samples,Department of Chemical Engineering;IIT Bombay;BET;Centre for Research in Nanotechnology and Science—Sophisticated Analytical Instrumental Centre;CRNTS;IIT Bombay,"The authors would like to thank Prof. Jayesh Bellare, Department of Chemical Engineering, IIT Bombay for providing facilities for BET surface area measurement and Centre for Research in Nanotechnology and Science—Sophisticated Analytical Instrumental Centre (CRNTS-SAIF) at IIT Bombay for FTIR analysis of algal samples.",like;thank;provide
3_Biotech/PMC4987636.nxml,,Kiransinh Rajput,teachers;fellowship;course;study,the University Grants Commission,"Kiransinh Rajput is thankful to the University Grants Commission, New Delhi, for providing teachers fellowship during the course of the study.",provide
3_Biotech/PMC3339602.nxml,,G. S. Avadhani;Research Scientist,TEM;images,TEM,"The Authors are grateful to Dr. G. S. Avadhani, Principal Research Scientist, IISc, India, for taking TEM images.",take
3_Biotech/PMC3433876.nxml,,K. Veluthambi,tumefaciens;strain;pCAMBIA2301," Agrobacterium;Center for
Application of Molecular Biology;International Agriculture (CAMBIA","We thank Prof. K. Veluthambi, MKU, Madurai, India for  Agrobacterium tumefaciens  strain and Center for
Application of Molecular Biology to International Agriculture (CAMBIA), Australia
for pCAMBIA2301.",thank
3_Biotech/PMC4434411.nxml,0.0,Gerhard Kauer,help,Univeristy of Applied Sciences Emden,We would like to thank Gerhard Kauer (Univeristy of Applied Sciences Emden) for his help.,like;thank
3_Biotech/PMC3597131.nxml,,T. Kumar,authors;spectra;analyst;interpretation;spectra;results;facilities;work,SRM University,The authors are thankful to Dr. T. Kumar Mass spectra analyst for the interpretation of mass spectra results and the facilities provided by SRM University to support this work.,provide;support
3_Biotech/PMC3597135.nxml,,Rhitu Rai,Help;preparation;solutions;reading;manuscript,,"Help of Ms Payal Gupta, Mr R N Gupta in preparation of solutions, and critical reading of manuscript by Dr Rhitu Rai is gratefully acknowledged.",acknowledge
3_Biotech/PMC3597133.nxml,,A. Subrahmanyam,authors;thanks;strain;study,Meerut Institute of Engineering and Technology,"The authors want to express their thanks to Prof. A. Subrahmanyam, Meerut Institute of Engineering and Technology, Meerut, India for providing the strain for this study.",want;express;provide
3_Biotech/PMC3723860.nxml,,R. Malhotra,authors;help;analysis;data,Scientist (Statistics;National Dairy Research Institute,"The authors are thankful to Dr. R. Malhotra, Scientist (Statistics), National Dairy Research Institute (NDRI), Karnal for his help in statistical analysis of the data.",
3_Biotech/PMC3781265.nxml,,S.B. Roy,thanks;facility,Department of Physics;Banaras Hindu University;UP,"We would like to pay our sincere thanks to Dr. S.B. Roy for providing us FT-IR facility at Department of Physics, Banaras Hindu University, Varanasi 221005, UP, India.",like;pay;provide
3_Biotech/PMC3824787.nxml,,D. S. Kothari Post Doctoral Fellowships,Funding;support;work,the University Grants Commission,Funding support of this work includes Dr. D. S. Kothari Post Doctoral Fellowships from the University Grants Commission,include
3_Biotech/PMC3824786.nxml,,M. Pitchaimuthu;Principal Scientist,vegetable;okra;genotypes,Division of;Bangalore,"M. Pitchaimuthu, Principal Scientist, Division of vegetable Crops, IIHR, Bangalore for providing us the okra genotypes.",provide
3_Biotech/PMC3824786.nxml,,H.C. Prasanna,crop;improvement;suggestions;manuscript;preparation,Division of;Indian Institute Vegetable Research,"We are thankful to Dr. H.C. Prasanna, Division of crop improvement, Indian Institute Vegetable Research, India for his suggestions in manuscript preparation.",
3_Biotech/PMC3824784.nxml,0.0,Thomas M. Gradziel,plant;materials;study,,We thank Thomas M. Gradziel for providing plant materials for this study.,thank;provide
3_Biotech/PMC3824784.nxml,0.5,Helen Chan;Pedro J Martinez Garcia,Authors;laboratory;assistant;collaboration;lab;work;data;analysis,UC Davis,"Authors thank Helen Chan laboratory assistant and Pedro J Martinez Garcia postdoc at UC Davis, for their collaboration in lab work and data analysis.",thank;postdoc
3_Biotech/PMC3563744.nxml,0.0,David Summers,discussion;comments,Department of Genetics;University of Cambridge,"We would like to thank Prof David Summers (Department of Genetics, University of Cambridge) for helpful discussion and constructive comments.",like;thank
3_Biotech/PMC3563746.nxml,,S. Swaminathan,authors;gratitude;support;encouragement,"Centre for Nanotechnology;Advanced Biomaterials;Dean, Sponsored Research;SASTRA","The authors wish to express their sincere gratitude to Dr. S. Swaminathan (Director, Centre for Nanotechnology and Advanced Biomaterials and Dean, Sponsored Research, SASTRA, Thanjavur) for his constant support and encouragement.",wish;express
3_Biotech/PMC3563740.nxml,0.0,Arka Shirish,help;seeds,Indian Institute of Horticultural Research (IIHR,We acknowledge the help of Indian Institute of Horticultural Research (IIHR) for providing the seeds of Arka Shirish.,acknowledge;provide
3_Biotech/PMC3646113.nxml,0.0,Shripad N. Surwase;James S. Hyde;Christopher C. Felix,analysis;facility,Department of Biophysics and Center for Imaging Research Medical College of Wisconsin;EPR,"Shripad N. Surwase is thankful to Dr. James S. Hyde and Dr. Christopher C. Felix, Department of Biophysics and Center for Imaging Research Medical College of Wisconsin, Milwaukee, WI, USA, for providing EPR analysis facility.",provide
3_Biotech/PMC3646113.nxml,0.0,Shekhar B. Jadhav,fellowship;PURSE;program,"Department of Science and Technolgy, Government of;DST-PURSE","Shekhar B. Jadhav is thankful to Department of Science and Technolgy, Government of India, for providing fellowship under DST-PURSE program.",provide
3_Biotech/PMC3781264.nxml,,Fundacão de Amparo,authors,,The authors are thankful to Fundacão de Amparo,
3_Biotech/PMC3781266.nxml,0.5,Shilpi Thakur;Bhuvnesh Shrivastava,,Council of Scientific and Industrial Research;CSIR,"Ms. Shilpi Thakur and Mr. Bhuvnesh Shrivastava wish to acknowledge Council of Scientific and Industrial Research (CSIR), New Delhi, India for Senior Research Fellowship.",wish;acknowledge
3_Biotech/PMC3781266.nxml,,Vallabh Vidyanagar,instrumentation;facilities,Shilpi Thakur;Sophisticated Instrumentation Centre for Applied Research;Testing (SICART),"Shilpi Thakur also wants to acknowledge Sophisticated Instrumentation Centre for Applied Research and Testing (SICART), Vallabh Vidyanagar, Gujarat, India for providing instrumentation facilities.",want;acknowledge;provide
3_Biotech/PMC4949164.nxml,,P.P. Dhyani,facilities;encouragement,GBPIHED,"We thank Dr. P.P. Dhyani, Director GBPIHED for facilities and encouragement.",thank
3_Biotech/PMC3781261.nxml,1.0,Amrita Ranjan,authors;fellowship,the Ministry of New and Renewable Energy;NRE,The authors acknowledge the Ministry of New and Renewable Energy for providing NRE fellowship to Ms. Amrita Ranjan.,acknowledge;provide
3_Biotech/PMC4026452.nxml,,G. Bagyanarayana;K. Venkatachalam,authors;support;encouragement,Registrar;Palamuru University,"The authors are thankful to Prof. G. Bagyanarayana, Vice Chancellor and Prof. K. Venkatachalam, Registrar, Palamuru University for the constant support and encouragement.",
3_Biotech/PMC3964253.nxml,,B. Meyer;M. Rajab;M. Al-Buhairi;N. Venturina;M. Shoukri,DNA;sequencing;assistance;advice,,"We wish to thank Dr. B. Meyer, Mr. M. Rajab for helping in DNA sequencing, M. Al-Buhairi, N. Venturina for technical assistance, and Dr. M. Shoukri for statistical advice.",wish;thank;help
3_Biotech/PMC3964251.nxml,,Mahatma Gandhi University,authors;help;analysis;samples;instrumentation;facility,School of Chemical Sciences;Department of Biotechnology-Rapid,"The authors gratefully acknowledge School of Chemical Sciences, Mahatma Gandhi University, Kottayam, Kerala, India, for the help and support for the analysis of samples and also DBT-RGYI (Department of Biotechnology-Rapid Grant Young Investigator) Programme for the instrumentation facility.",acknowledge;support
3_Biotech/PMC3964250.nxml,,Galgotias University,authors;opportunity;management;facilities;encouragement;work,Vellore Institute of Technology,The authors take this opportunity to thank the management of Vellore Institute of Technology and Galgotias University for providing the facilities and encouragement to carry out this work.,thank;provide;carry
3_Biotech/PMC3964258.nxml,,R. Chenraj Jain;N. Sundararajan;S. Sundara Rajan,thanks;laboratory;facilities;research;work,"Jain Group of Institutions;Jain University;Genohelix Biolabs;A Division of Centre for Advanced Studies;Biosciences, Jain University, Bangalore","Our special thanks to Dr. R. Chenraj Jain, Chairman of Jain Group of Institutions, Dr. N. Sundararajan, Vice-Chancellor of Jain University and Dr. S. Sundara Rajan, Director of Genohelix Biolabs, A Division of Centre for Advanced Studies in Biosciences, Jain University, Bangalore for providing us with the laboratory facilities required for this research work.",provide;require
3_Biotech/PMC4145622.nxml,0.0,Pradosh Roy;Sujoy Kumar Dasgupta,support,Department of Microbiology;Bose Institute,"We thank late Dr. Pradosh Roy and Prof. Sujoy Kumar Dasgupta, Department of Microbiology, Bose Institute, Kolkata for their active support.",thank
3_Biotech/PMC4145627.nxml,0.0,Manoj Ranjan Nayak,encouragement;support,Anusandhan University,"We are thankful to Prof. Manoj Ranjan Nayak, President, Siksha O Anusandhan University for his encouragement and support.",
3_Biotech/PMC4145620.nxml,0.0,Emmanuel Aispuro-Hernández,Authors;support,,"Authors thank Emmanuel Aispuro-Hernández, M.Sc. for technical support and Drs.",thank
3_Biotech/PMC4145620.nxml,0.5025125628140703,Rogerio R. Sotelo-Mundo;Adriana Muhlia-Almazan,revisions;suggestions,,Rogerio R. Sotelo-Mundo and Adriana Muhlia-Almazan for helpful revisions and suggestions.,
3_Biotech/PMC4162903.nxml,0.0,Jatin K Srivastava,contributors;review;article;chairman;facilities;compilation;review;paper,Global Group of Institutions,The Corresponding and the one of the main contributors of this review article Dr. Jatin K Srivastava is acknowledged to the chairman of Global Group of Institutions Lucknow for providing the necessary facilities during the compilation of this review paper.,acknowledge;provide
3_Biotech/PMC4145623.nxml,,S. Chakravarthi;S.P. Subramani;S. Shanmugam,authors;Mayavel;seeds,A. Mayavel;V. Chinnadurai,"The authors acknowledge B. Nagarajan, A. Mayavel, S. Chakravarthi, S.P. Subramani, S. Shanmugam, V. Chinnadurai for producing the hybrid seeds.",acknowledge;produce
3_Biotech/PMC4145623.nxml,,M. Ganesan,field;assessment,V.K.W. Bachpai,V.K.W. Bachpai and M. Ganesan has field planted the F 1  hybrids for further assessment.,plant;hybrid
3_Biotech/PMC4145623.nxml,,N. Krishna Kumar,Authors;support;study,IFGTB,"Authors are grateful to Dr. N. Krishna Kumar, Director, IFGTB for his constant support to carry out this study.",carry
3_Biotech/PMC4235891.nxml,,U Basu;University of Kalyani;P Roy,authors;nanodrop;TEM;facilities,TEM,"The authors would like to thank Dr. U Basu (Department of Molecular Biology and Biotechnology, University of Kalyani) and Dr. P Roy (SINP) for providing nanodrop and TEM facilities, respectively.",like;thank;provide
3_Biotech/PMC4235882.nxml,0.0,Medhat El-Sebaie,cooperation;blood;donors;participation;research,,We acknowledge the cooperation of Dr. Medhat El-Sebaie and the honorable blood donors for their participation in this research.,acknowledge
3_Biotech/PMC4235882.nxml,0.7455470737913485,Nikki Venturina;Sara Al-Qahtani;Najla Al-Harbi;David Lloyd,assistance;advice;curve;fitting;advices;team;assistance,IRSN;Biotechnology Unit,"We would like to thank Nikki Venturina, Sara Al-Qahtani and Najla Al-Harbi for their technical assistance, Dr. Joan-Francesc Barquinero, IRSN, France, for his advice on curve fitting, Professor David Lloyd for his expert advices and the Biotechnology Unit team for their administrative assistance.",like;thank
3_Biotech/PMC4235887.nxml,0.0,Kazuki Terauchi,A.;platensis,,A. platensis  NIES-39 was kindly provided by Dr. Kazuki Terauchi.,provide
3_Biotech/PMC4235890.nxml,,S.C. Basappa,encouragement;comments;manuscript,Scientist;Central Food Technological Research Institute;CFTRI,"We are thankful to Dr. S.C. Basappa, former Deputy Director and Scientist, Central Food Technological Research Institute (CFTRI), Mysore, for his encouragement and critical comments on the manuscript.",
3_Biotech/PMC4026454.nxml,1.0,Tamil Nadu,authors;authorities,Annamalai University,"The authors are thankful to the authorities of Annamalai University, Tamil Nadu, India.",
3_Biotech/PMC4026448.nxml,,RR Baadhe,authors;RR;Ph.D.;fellowship,,"One of the authors, RR Baadhe, acknowledges M.H.R.D, India, for the Ph.D. fellowship.",acknowledge
3_Biotech/PMC4624149.nxml,,B. N. Johri,Authors;editing;review;manuscript,,Authors are also thankful to Prof. B. N. Johri for editing and review of the manuscript.,
3_Biotech/PMC4026447.nxml,,K. R. Kranthi,authors;encouragement;support,Central Institute for Cotton Research,"The authors thank Dr. K. R. Kranthi, Director, Central Institute for Cotton Research, Nagpur, for his encouragement and support.",thank
3_Biotech/PMC4026449.nxml,,S. Girisham,authors;department;laboratory;facilities,Kakatiya University Warangal,"The authors are thankful to Prof. S. Girisham, Head of the department Microbiology, Kakatiya University Warangal for providing laboratory facilities.",provide
3_Biotech/PMC4026451.nxml,0.0,Matthew Benedict,suggestions,,We also thank Matthew Benedict for his helpful suggestions.,thank
3_Biotech/PMC4026446.nxml,1.0,Sunita Prakash,mass;spectrometers,KP,KP acknowledges Ms. Sunita Prakash for helping with mass spectrometers.,acknowledge;help
3_Biotech/PMC4162895.nxml,0.0,Arya Vaidya Sala,Authors;facilities;programme,TATA Trust,"Authors are grateful to the Management, Arya Vaidya Sala, Kottakkal and TATA Trust, Mumbai, for providing the facilities for taking up the programme.",provide;take
3_Biotech/PMC4162895.nxml,,P. Vipin,help,,Technical help rendered by Mr. P. Vipin is also gratefully acknowledged.,render;acknowledge
3_Biotech/PMC4162902.nxml,1.0,Natsuko Kurata,reference;strains;parasporin;genes,Food Research Institute;Fukuoka Industrial Technology Centre,"We thank Dr. Natsuko Kurata, Biotechnology and Food Research Institute, Fukuoka Industrial Technology Centre, Japan, for providing the reference strains of Bt for parasporin genes.",thank;provide
3_Biotech/PMC4162892.nxml,,Kazunobu Matsushita,assistance,Yamaguchi University,We thank Dr. Kazunobu Matsushita (Yamaguchi University) for technical assistance.,thank
3_Biotech/PMC4162896.nxml,1.0,Parvin Shariati,authors;language,,The authors would like to acknowledge Dr. Parvin Shariati for kindly editing the English language.,like;acknowledge;edit
