filename,Is Female,Names,Nouns,Organizations,Text,Verbs
CBE_Life_Sci_Educ/PMC3671653.nxml,0.49874055415617125,Anne Todgham;Erik Dunmire;Edward Connor;Lynne Dowdy,authors;discussions;support;help;statistics;permission;class;demonstration,Professors Chris Moffatt,"The authors acknowledge Professors Chris Moffatt and Anne Todgham for helpful discussions, Erik Dunmire for technical support, Edward Connor for help with statistics, and Lynne Dowdy for permission to perform the in-class demonstration.",acknowledge;perform
CBE_Life_Sci_Educ/PMC3763016.nxml,0.47743966421825806,Mark Sandheinrich;Nick Downey;Tisha King;Tim Gerber;Roger Haro;Jennifer Miskowsky;Eric Strauss;Karen Smith;Michi Tobler;Katherine Moriarty,faculty;faculty;staff;biology;courses;data;student;concepts;student;responses,University of Wisconsin La Crosse;Oklahoma State University;Karen McBee,"We also thank University of Wisconsin La Crosse faculty (Mark Sandheinrich, Nick Downey, Tisha King Heiden, Tim Gerber, Roger Haro, Anita Baines, Jennifer Miskowsky, and Eric Strauss) and Oklahoma State University faculty and staff (Karen McBee, Karen Smith, and Michi Tobler), who surveyed their biology courses to gather data on student concepts, and Katherine Moriarty, who transcribed student responses.",thank;survey;gather;transcribe
CBE_Life_Sci_Educ/PMC3763016.nxml,1.0,Billie Swalla,members;contributions;survey;access;listserv;students;institutions;time,the EvoDevo ListServ;Diggle,"Finally, we thank members of the EvoDevo ListServ for their anonymous contributions to our survey (and Pam Diggle and Billie Swalla for access to the listserv), as well as the many students at several institutions who contributed their time.",thank;contribute
CBE_Life_Sci_Educ/PMC4152201.nxml,,Scott Arico;Gwendolyn Casebeer;Katherine Culatta;Kristin Emery;Sarah Farmer;Jacob Francis;David Greene;Jennafer Hamlin;Ashley Hanes;Karissa Keen;Aaron Maser;Joseph McKenna;Laudan Nahavandi;Megan Rayfield;Matthew Searels;Katherine Selm;Anna Sitko;Alice Smithlund;Alyssa Teat;Emmalie von Kuilenberg;Margot Wallston;Andrew Watson;Andrew Wilson,research;students;execution;project,,"Undergraduate research students who contributed significantly to the execution of this project included Scott Arico, Gwendolyn Casebeer, Katherine Culatta, Kristin Emery, Sarah Farmer, Jacob Francis, David Greene, Jennafer Hamlin, Ashley Hanes, Karissa Keen, Aaron Maser, Joseph McKenna, Laudan Nahavandi, Megan Rayfield, Matthew Searels, Katherine Selm, Anna Sitko, Alice Smithlund, Alyssa Teat, Emmalie von Kuilenberg, Margot Wallston, Andrew Watson, and Andrew Wilson.",contribute;include
CBE_Life_Sci_Educ/PMC4152201.nxml,0.33557046979865773,James McGlinn;Melissa Smith;John Myers,research;board;feedback;assessment;tools;sites,Moodle,"James McGlinn and the UNC Asheville's institutional research board (Melissa Smith) provided feedback about assessment tools, and John Myers created Moodle sites.",provide;create
CBE_Life_Sci_Educ/PMC4152202.nxml,1.0,Staci Sharp;Hannah Miller,thanks;teachers;contributions;work,,"Special thanks to Staci Sharp, Hannah Miller, and the  Carbon TIME  teachers for their contributions to this work.",
CBE_Life_Sci_Educ/PMC4152203.nxml,0.4991652754590985,Tara Davenport;Heather Smith;Steve Nelms;Philipp Simon;Irwin Goldman;Rosemary Russ,authors;thanks;input;assistance;curriculum;data;management;support;advice;course;appreciation;students;study,Katalin,"The authors extend our sincere thanks to Tara Davenport, Heather Smith, and Katalin Dósa for input and assistance in implementing the curriculum; to Steve Nelms for technical data management support; to Philipp Simon, Irwin Goldman, and Rosemary Russ for their thoughtful advice; and, of course, our deep appreciation to the many Biocore students who participated in this study and continually inspire us.",extend;implement;participate;inspire
CBE_Life_Sci_Educ/PMC4152204.nxml,0.0,Steve Baskauf;Martin Wall,authors;images;use,Nadia Talent;Rodger Evans,"The authors thank Steve Baskauf ( http://bioimages.vanderbilt.edu ), Martin Wall, Nadia Talent, and Rodger Evans for providing images for use in VL-PI.",thank;provide
CBE_Life_Sci_Educ/PMC4152204.nxml,1.0,Isabel Gauthier,help;processing;literature;stages;work;project,,We also thank Isabel Gauthier for her help in understanding the visual-processing literature during the early stages of work on this project.,thank;understand
CBE_Life_Sci_Educ/PMC4152204.nxml,1.0,Victoria Hollowell,editor;head;press;support;project,,"We thank Victoria Hollowell, the scientific editor and head of the press, for her support of the project.",thank
CBE_Life_Sci_Educ/PMC4152205.nxml,1.0,Alyson Saville,thanks;help;testing;participants,,Special thanks to Alyson Saville for her help recruiting and testing participants.,recruit
CBE_Life_Sci_Educ/PMC4152207.nxml,0.6449275362318841,Erika Bagley;Andrea Reubens;Bob Henshaw,support;project;ground;analysis;help;collection;survey;data,the Center for Faculty Excellence;UNC,"We acknowledge support from the Center for Faculty Excellence at UNC, specifically Erika Bagley and Andrea Reubens, for getting the project off the ground with initial statistical analysis, and Bob Henshaw for his help with the collection of survey data.",acknowledge;get
CBE_Life_Sci_Educ/PMC4152207.nxml,0.6077235772357724,Alison Crowe;Scott Freeman;Chris Lenn;Kathrin Stanger-Hall;Mary Pat Wenderoth,contributions;versions;manuscript,Mercedes Converse,"We also thank Mercedes Converse, Alison Crowe, Scott Freeman, Chris Lenn, Kathrin Stanger-Hall, and Mary Pat Wenderoth for their thoughtful contributions to early versions of the manuscript.",thank
CBE_Life_Sci_Educ/PMC3292070.nxml,0.5,Wayne Jacobson;Mary Lidstrom,colleagues;guidance;years;music,University of Washington;the University of Iowa,University of Washington colleagues Wayne Jacobson (now at the University of Iowa) and Mary Lidstrom provided guidance during my early years of teaching with music.,provide;teach
CBE_Life_Sci_Educ/PMC3292070.nxml,0.6655518394648829,Anthony Dumas;Kate Clark;Merryl Goldberg,ideas;collaboration;teaching;assistant,"Wendy Silk of the University of California, Davis;Bio-Rad;California State University","More recently, ideas presented here have been developed in collaboration with Wendy Silk of the University of California, Davis and her teaching assistant Anthony Dumas, Kate Clark of Bio-Rad, and Merryl Goldberg of California State University, San Marcos.",present;develop
CBE_Life_Sci_Educ/PMC3292070.nxml,0.7692307692307692,Linda Martin-Morris;Karen Freisem;Jan Carmikle,comments;manuscript;discussions;copyright;issues,the University of Washington;the University of Washington;University of California,"I also thank Linda Martin-Morris of the University of Washington for providing  Table 2 , Karen Freisem of the University of Washington for comments on the manuscript, and Jan Carmikle of University of California, Davis for discussions of copyright issues.",thank;provide
CBE_Life_Sci_Educ/PMC3940459.nxml,1.0,Sandra Laursen,Thanks;leadership;role;meeting,,Thanks to Sandra Laursen for taking a leadership role in organizing this meeting.,take;organize
CBE_Life_Sci_Educ/PMC4710395.nxml,1.0,Mary Lee Ledbetter,suggestions,,We thank Mary Lee Ledbetter for many useful stylistic suggestions.,thank
CBE_Life_Sci_Educ/PMC4152214.nxml,0.0,Abdel Azim Zumrawi,help;aspects;paper,,"We thank Abdel Azim Zumrawi of our Centre for Teaching, Learning and Technology for his help with the statistical aspects of this paper.",thank
CBE_Life_Sci_Educ/PMC4255352.nxml,0.5,Michael Chester;Margarita Hernandez,authors;scoring;student;phylogenies;modules;comments;manuscript,,The authors thank Michael Chester and Margarita Hernandez for scoring student phylogenies and helping to implement the modules and for helpful comments on the manuscript.,thank;help;implement
CBE_Life_Sci_Educ/PMC4255352.nxml,0.3729246487867177,Sarah Allen;Andy Crowl;Blake Geraci;Grant Godden;Luis Mourino;Douglas Soltis;Pamela Soltis;Milda Stanislauskas,modules,,"We also thank Sarah Allen, Andy Crowl, Blake Geraci, Grant Godden, Luis Mourino, Douglas Soltis, Pamela Soltis, and Milda Stanislauskas for volunteering to help with the modules.",thank;volunteer;help
CBE_Life_Sci_Educ/PMC3763013.nxml,1.0,Janet Chan-Wong Swee,,,I thank Janet Chan-Wong Swee,thank
CBE_Life_Sci_Educ/PMC3940457.nxml,,A. Malcolm Campbell,A.;comments;suggestions;feature,,We thank A. Malcolm Campbell for critical comments and helpful suggestions on this feature.,thank
CBE_Life_Sci_Educ/PMC3940460.nxml,0.6655518394648829,Sara Brownell;Mary Pat Wenderoth;Steven Kalinowski,conversations;Tessa;opinions,Tessa Andrews (University of Georgia;University of Washington;University of Montana,"We benefited from excellent conversations with Tessa Andrews (University of Georgia), Sara Brownell and Mary Pat Wenderoth (University of Washington), and Steven Kalinowski (University of Montana), who do not necessarily agree with our opinions.",benefit;agree
CBE_Life_Sci_Educ/PMC3940466.nxml,1.0,Erlinda Villamoran;Sarmiento Campus,researcher;participation;support;conduct;study;people;students;colleagues,BulSU Graduate School and BulSU Research and Development Center,"The researcher thanks the following for their participation and support in the conduct of the study: Dr. Erlinda Villamoran, the people of BulSU Graduate School and BulSU Research and Development Center, and my students and colleagues at Sarmiento Campus.",thank;follow
CBE_Life_Sci_Educ/PMC4041503.nxml,,J. H. Buikema,PhD,,"We thank J. H. Buikema, PhD, and Prof. R.H.",thank
CBE_Life_Sci_Educ/PMC3940461.nxml,0.7999999999999999,Ben Wiggins;Sara Brownell;Sarah Eddy;Elli Theobald;Mary Pat Wenderoth,discussion;access;post;testing;data;biology;students;reviewers;comments;manuscript,,"We thank Ben Wiggins for discussion and for access to the pre–post testing data on introductory biology students, and Sara Brownell, Sarah Eddy, Elli Theobald, Mary Pat Wenderoth, and two anonymous reviewers for comments that improved the manuscript.",thank;improve
CBE_Life_Sci_Educ/PMC3940465.nxml,0.0,George Lucas,students;study;instructors;expert;reviewers;members;reviewers,the EvoCI Toolkit Working Group;the Biology Education Research Group;the University of Washington,We thank the students who participated in this study and their instructors; expert reviewers; George Lucas for inspiring the name GeDI; other members of the EvoCI Toolkit Working Group; NESCent; the Biology Education Research Group at the University of Washington; and two anonymous reviewers.,thank;participate;inspire
CBE_Life_Sci_Educ/PMC3940467.nxml,1.0,Michelle Baker,students;study;students;courses,,We thank all the students who participated in this study and Michelle Baker for allowing us to survey students in her courses.,thank;participate;allow;survey
CBE_Life_Sci_Educ/PMC3940467.nxml,0.0,Paul Smith,plagiarism;assignment;study,,We are very grateful to Paul Smith for allowing E.A.H. to adapt the plagiarism assignment for this study.,allow;adapt
CBE_Life_Sci_Educ/PMC4041510.nxml,0.0,Thomas Kim,faculty;members;data;assessments;students;feedback;manuscript,,"We thank participating faculty members who provided data by giving the assessments to their students, and Dr. Thomas Kim for critical feedback on the manuscript.",thank;participate;provide;give
CBE_Life_Sci_Educ/PMC3105927.nxml,0.5,Jennifer Hill;Matt Serra,assistance;data;tests,Duke University's Office of Assessment,We thank Jennifer Hill and Matt Serra in Duke University's Office of Assessment for their assistance with collecting academic and demographic data and for running many of the statistical tests for us.,thank;collect;run
CBE_Life_Sci_Educ/PMC3105927.nxml,0.8091133004926108,Arielle Cooley;Whitney Jones;Laura Simmons Kovacs;Tami McDonald;Cary Moskovitz;Kathryn Perez;Andrew Procter;Amy Sayle;Robin Smith,thanks;raters,,"Additional thanks go to our raters: Arielle Cooley, Whitney Jones, Laura Simmons Kovacs, Tami McDonald, Cary Moskovitz, Kathryn Perez, Andrew Procter, Amy Sayle, and Robin Smith.",
CBE_Life_Sci_Educ/PMC5132370.nxml,,Lance Pérez;Ruth Heaton;Leilani Arthurs;Doug Golick;Kevin Lee;Marilyne Stains;Matt Patton;Hee-Jeong Kim;Ruth Lionberger;Jeremy van Hof;Beverly Russell;Sydney Brown;Tareq Daher;Eyde Olson;Brian Wilson;Jim Hammerman;Amy Spiegel,work;conjunction;efforts;project;team,Trisha,"This work was completed in conjunction with broader efforts by the UNL ARISE project team, which included Lance Pérez, Ruth Heaton, Leilani Arthurs, Doug Golick, Kevin Lee, Marilyne Stains, Matt Patton, Trisha Vickrey, Hee-Jeong Kim, Ruth Lionberger, Jeremy van Hof, Beverly Russell, Sydney Brown, Tareq Daher, Eyde Olson, Brian Wilson, Jim Hammerman, and Amy Spiegel.",complete;include
CBE_Life_Sci_Educ/PMC5132370.nxml,1.0,Mary Durham;Joanna Hubbard;Marilyne Stains,community;research;discussions;manuscript,the UNL Discipline-Based Education Research,"We are grateful to Mary Durham, Joanna Hubbard, Marilyne Stains, and the UNL Discipline-Based Education Research community for critical research discussions and feedback on the manuscript.",feedback
CBE_Life_Sci_Educ/PMC3046885.nxml,0.0,Dean Phil Bailey;Luis Obispo;Interim Dean Jane Bruner;Dean Sheldon Axler,research;campus;administrators,CSU;Cal Poly;Dean Gary Novak;CSU;CSU Stanislaus;Dean Stanley Malloy;San Diego State University;San Francisco State University,"Funding for this research was generously provided by the following CSU campus administrators: Dean Phil Bailey (Cal Poly San Luis Obispo), Dean Gary Novak (CSU Los Angeles), Interim Dean Jane Bruner (CSU Stanislaus), Dean Stanley Malloy (San Diego State University), and Dean Sheldon Axler (San Francisco State University).",fund;provide;follow
CBE_Life_Sci_Educ/PMC3046885.nxml,0.5102040816326531,Dean Steve Murray;Barbara Gonzalez,space;use;laboratory;participation;validation;survey;instrument,CSU;CSU;CSU,"We thank Dean Steve Murray (CSU Fullerton) for providing space to meet, Dr. Barbara Gonzalez (CSU Fullerton) for use of her laboratory, and SFES outside the CSU for their participation in validation of the survey instrument.",thank;provide;meet
CBE_Life_Sci_Educ/PMC3292062.nxml,0.0,Ronald Patterson,reading;manuscript;comments,,We thank Ronald Patterson for his careful reading of the manuscript and helpful comments.,thank
CBE_Life_Sci_Educ/PMC3292062.nxml,0.339041095890411,Chris Wilson;Amy Lark;Duncan Sibley,authors;contributions;rest;community,Center for Research on College Science Teaching and Learning,"The authors gratefully acknowledge the contributions of Chris Wilson, Amy Lark, Duncan Sibley, and the rest of Center for Research on College Science Teaching and Learning community.",acknowledge
CBE_Life_Sci_Educ/PMC3292062.nxml,1.0,Jean Beland,assistance;manuscript;preparation,,We also thank Jean Beland for assistance in manuscript preparation.,thank
CBE_Life_Sci_Educ/PMC4041511.nxml,0.4297994269340974,Gloria Blanquel;Calvin Lung;Matthew Bischoff;Kathleen Fisher;Terri McElhinny;Mike U. Smith;Ryan Walker,students;study;instructors;class;time;support;project;expert;reviewers;student;research;assistants;members;NESCent,the EvoCI Toolkit Working Group,"We thank the students who participated in this study and the instructors who gave up class time in support of this project; expert reviewers; student research assistants Gloria Blanquel, Calvin Lung, and Matthew Bischoff; other members of the EvoCI Toolkit Working Group, especially Kathleen Fisher, Terri McElhinny, Mike U. Smith, Ryan Walker, and NESCent.",thank;participate;give
CBE_Life_Sci_Educ/PMC4041511.nxml,0.5,Jon Herron;Susan Maruca,support;input;employees,SimBio;Eli Meir,"We received invaluable support and input from Jon Herron and from SimBio employees, particularly Eli Meir and Susan Maruca.",receive
CBE_Life_Sci_Educ/PMC4041501.nxml,1.0,Laurel Eckhardt,support;faculty;development;workshops,,We thank Prof. Laurel Eckhardt for support of the faculty development workshops at the CUNY Graduate Center; Profs.,thank
CBE_Life_Sci_Educ/PMC4041501.nxml,0.7925311203319502,Shubha Govind;Anu Janakiraman;Dara Duncan;Alan Gottesman;Jamila Hoque,comments;draft;manuscript;assistance;data;processing;discussions;data,,"Shubha Govind and Anu Janakiraman for comments on a draft of the manuscript; and Dara Duncan, Alan Gottesman, and Jamila Hoque for assistance in data processing and discussions of the data.",
CBE_Life_Sci_Educ/PMC3671646.nxml,0.6085192697768763,Chris Bauer;Melanie Cooper;Catherine Crouch;Mike Klymkowsky;Jessica Watkins,authors;discussions;issues;interdisciplinarity,,"The authors also thank Chris Bauer, Melanie Cooper, Catherine Crouch, Mike Klymkowsky, and Jessica Watkins for their discussions on issues of interdisciplinarity.",thank
CBE_Life_Sci_Educ/PMC4041507.nxml,,A. Riley;L. MacBride,support;data;access;handling;analysis,Institutional Research at Marquette University,"We acknowledge the support of A. Riley and L. MacBride, Institutional Research at Marquette University, in data access, handling, and analysis.",acknowledge
CBE_Life_Sci_Educ/PMC4041507.nxml,1.0,Lisa Petrella;Shannon Colton;Gina Vogt,program;directors;assessment;questions,Marquette University;the Center for Biomolecular Modeling;the Milwaukee School of Engineering,"We thank Lisa Petrella, Marquette University, and Shannon Colton and Gina Vogt, program directors of the Center for Biomolecular Modeling at the Milwaukee School of Engineering, for categorizing the assessment questions.",thank;categorize
CBE_Life_Sci_Educ/PMC4041499.nxml,0.0,Toby Bradshaw;Kevin Mihata,faculty;effort;leadership,UW,"We thank the UW faculty who participated in this effort, particularly Toby Bradshaw and Kevin Mihata for leadership.",thank;participate
CBE_Life_Sci_Educ/PMC4041505.nxml,,T. E.,members,GCAT,A.M.C. and T. E. are members of GCAT SynBio.,
CBE_Life_Sci_Educ/PMC5132385.nxml,1.0,Mary Lee Ledbetter,suggestions,,We thank Mary Lee Ledbetter for many thoughtful suggestions.,thank
CBE_Life_Sci_Educ/PMC4152212.nxml,0.4428969359331476,Peter Kennelly;Daniel Schwartz;Robin Wright;Adele Wolfson,Thanks;board;members,,"Thanks to our advisory board members, Peter Kennelly, Daniel Schwartz, Robin Wright, and Adele Wolfson.",
CBE_Life_Sci_Educ/PMC4152212.nxml,0.6241778891324773,Kevin Ahern;Karen Anderson;Rodney Austin;Adam Cassano;Colleen Conway;Carol Dieckman;Martina Ederer;Matthew Fisher;Katherine Frato;Bruce Heyen;Margaret Kanipes;Jennifer Knight;Lisa Kroutil;Anne Kruchten;Paula Lemons;Kimberly Linenberger;Jenny McFarland;Tracey Murray;Philip Ortiz;Jeffrey Owens;David Parkin;Mandy Schivell;Janet Schottel;Duane Sears;Tricia Shepherd;Daniel Smith;Kimberly Tanner;Ann Taylor;Heather Tienson;Sachel Villafañe;Mark Werth;Adele Wolfson,thanks;faculty;members;4-d;workshops;participants,,"A special thanks to faculty members who attended 2- or 4-d workshops: Kevin Ahern, Karen Anderson, Rodney Austin, Adam Cassano, Colleen Conway, Carol Dieckman, Martina Ederer, Matthew Fisher, Katherine Frato, January Haile, Bruce Heyen, Margaret Kanipes, Jennifer Knight, Lisa Kroutil, Anne Kruchten, Paula Lemons, Kimberly Linenberger, Sunil Malapati, Jenny McFarland, Tracey Murray, Philip Ortiz, Jeffrey Owens, David Parkin, Mandy Schivell, Janet Schottel, Duane Sears, Tricia Shepherd, Daniel Smith, Kimberly Tanner, Ann Taylor, Heather Tienson, Sachel Villafañe, Mark Werth, Adele Wolfson, and several participants who wished to remain anonymous.",attend;wish;remain
CBE_Life_Sci_Educ/PMC4152212.nxml,0.0,Trey Morgan,help;student;data;processing,,"We appreciate the help of Trey Morgan, a student who helped with data processing.",appreciate;help
CBE_Life_Sci_Educ/PMC4710394.nxml,0.7946611909650924,Sura Alqudah;Fatima Irshaidat;Mandana Rezaeiahari;Mohammad Khasawneh;Elizabeth Button,concerns;work;life;balance;assistance;analyses;work;input;planning;panel;discussions,,"We thank Sura Alqudah and Fatima Irshaidat for alerting us to students’ concerns about work–life balance, Mandana Rezaeiahari for assistance with initial analyses, Dr. Mohammad Khasawneh for directing their work, and Elizabeth Button for input into planning of the panel discussions.",thank;alert;direct
CBE_Life_Sci_Educ/PMC3846521.nxml,0.6666666666666666,Yolanda George;Gerard Boulin;Cathy Ledec,authors,American Association for the Advancement of Science,"The authors thank Yolanda George, Gerard Boulin, and Cathy Ledec (American Association for the Advancement of Science",thank
CBE_Life_Sci_Educ/PMC3846521.nxml,1.0,Carr Thompson;Donna Vogel;Justine Johnson;Chinonye Nnakwe,resource;support;work;support,Directorate for Education and;Human Resources;Burroughs Wellcome Fund;Audrey Trapp;Johns Hopkins University;University of Maryland;University of Chicago,"Directorate for Education and Human Resources) and Carr Thompson (Burroughs Wellcome Fund) for resource support of this work, and Donna Vogel and Audrey Trapp (Johns Hopkins University), Justine Johnson (University of Maryland, Baltimore County), and Chinonye Nnakwe (University of Chicago) for additional support.",
CBE_Life_Sci_Educ/PMC3846521.nxml,0.7493734335839599,Sherilynn Black;Kate Stoll;Richard Linton;Valerie Wilson,review;manuscript;submission,Heather Metcalf,"We also thank Sherilynn Black, Kate Stoll, Heather Metcalf, Richard Linton, and Valerie Wilson for review of the manuscript prior to submission.",thank
CBE_Life_Sci_Educ/PMC3846521.nxml,1.0,Muriel Poston;Sylvia James;Jessie DeAro,thanks;support;work,NSF,"K.D.G. thanks Muriel Poston, Sylvia James, and Jessie DeAro at the NSF for support of this work.",
CBE_Life_Sci_Educ/PMC4255343.nxml,0.0,Malcolm Campbell,comments;suggestions,,We thank Malcolm Campbell for his useful editorial comments and suggestions.,thank
CBE_Life_Sci_Educ/PMC4255347.nxml,,J. Collins;C. Carter;S. Eddy,reviewers;suggestions;versions;manuscript,,"Additionally, we thank J. Collins, C. Carter, S. Eddy, and two anonymous reviewers for helpful suggestions on earlier versions of the manuscript.",thank
CBE_Life_Sci_Educ/PMC4255354.nxml,,A. Nicholas;J. Shaffer;A. Williams,feedback;manuscript,,"We thank A. Nicholas, D. O’Dowd, J. Shaffer, and A. Williams for constructive feedback regarding the manuscript.",thank
CBE_Life_Sci_Educ/PMC4255349.nxml,0.7221288515406162,Elizabeth Baker;Stacy Boyle;Tracy Deschaine;Andrew Ford;Kathryn Priest Glidden;Marshall Haas;Kate Hayes;Beth Haynes;Bob Kumpa;Lori LaCombe-Burby;Melissa Lewis;John Mannette;Lori Matthews;Nicole Novak;Patti Pelletier;Beth Smyth-Handley;Joanna Stevens;Thomas White,authors;contributions;school;teachers;observers;faculty;members;teachers;classes;observations,Meredith Shelton;the University of Maine,"The authors very much appreciate the contributions of the middle and high school teachers who served as observers (Elizabeth Baker, Stacy Boyle, Tracy Deschaine, Lauren Driscoll, Andrew Ford, Kathryn Priest Glidden, Marshall Haas, Kate Hayes, Beth Haynes, Bob Kumpa, Lori LaCombe-Burby, Melissa Lewis, John Mannette, Lori Matthews, Nicole Novak, Patti Pelletier, Meredith Shelton, Beth Smyth-Handley, Joanna Stevens, and Thomas White) and the University of Maine faculty members who welcomed the teachers into their classes for observations.",appreciate;serve;welcome
CBE_Life_Sci_Educ/PMC4255349.nxml,0.5991983967935872,Paula Lemons;Scott Merrill;Mary Tyler;Jill Voreis;Carl Wieman,feedback;article,,"We also thank Paula Lemons, Scott Merrill, Mary Tyler, Jill Voreis, and Carl Wieman for helpful feedback on this article.",thank
CBE_Life_Sci_Educ/PMC4255356.nxml,1.0,Jennifer Knight;Bailey Keller,review;manuscript;assistance;survey;design,,We thank Jennifer Knight for critical review of the manuscript and Bailey Keller for assistance with survey design.,thank
CBE_Life_Sci_Educ/PMC4255350.nxml,0.8191681735985533,Shifali Arora;Oni Celestin;Patricia Forcinito;Natasha Lugo-Escobar;Steve Schultz;Susan Singer,authors;comments;suggestions,Sharmi Das,"The authors thank Shifali Arora, Oni Celestin, Sharmi Das, Patricia Forcinito, Natasha Lugo-Escobar, Steve Schultz, and Susan Singer for insightful comments and suggestions.",thank
CBE_Life_Sci_Educ/PMC4255350.nxml,1.0,Beth Mitchneck;Sylvia James,support;work,,Beth Mitchneck and Sylvia James for support of this work.,
CBE_Life_Sci_Educ/PMC4255353.nxml,0.39839034205231383,Julia Bowsher;Warren Christensen;Jeff Boyer;Erika Offerdahl;Stuart Haring,comments;versions;manuscript,,"We are grateful to Julia Bowsher, Warren Christensen, Jeff Boyer, Erika Offerdahl, and Stuart Haring for comments on earlier versions of the manuscript.",
CBE_Life_Sci_Educ/PMC4255345.nxml,1.0,Jennifer Daly;Karen Ball,authors;assistance;assistance,,The authors thank Ms. Jennifer Daly for administrative and editorial assistance and Ms. Karen Ball for administrative assistance.,thank
CBE_Life_Sci_Educ/PMC4255345.nxml,1.0,Liza Cariaga-Lo;Laura Liscum;Elizabeth Solomon,roles;group;facilitators,,"We also thank Liza Cariaga-Lo, Laura Liscum, and Elizabeth Solomon for their roles as group facilitators.",thank
CBE_Life_Sci_Educ/PMC4803097.nxml,0.5975855130784709,Samuel Deluccia;Melissa Haggerty;Courtney Franceschi;Jamila Hoque;William Smith,efforts;faculty;development;workshops;events;conferences;staff;colleges,,"We thank Samuel Deluccia, Melissa Haggerty, Courtney Franceschi, and Jamila Hoque for their efforts in supporting the faculty development workshops, and the events and conferences staff at Hobart and William Smith colleges.",thank;support
CBE_Life_Sci_Educ/PMC4803097.nxml,1.0,Leslie Stevens,manuscript;feedback,Heather Bock,We thank Leslie Stevens and Heather Bock for manuscript feedback.,thank
CBE_Life_Sci_Educ/PMC4255346.nxml,1.0,Molly Malone,treatment;control;lessons;study,,"Molly Malone, the GSLC's Senior Education Specialist, who planned and taught the treatment and control lessons for this study.",plan;teach
