filename,Is Female,Names,Nouns,Organizations,Text,Verbs
Obesity_(Silver_Spring)/PMC3744630.nxml,0.0,David Allison,comments;suggestions,,We thank David Allison for his helpful comments and suggestions.,thank
Obesity_(Silver_Spring)/PMC3748182.nxml,1.0,Michelle Dondanville;Jynene Black;Johanna Heron;Cristiane Kaufmann;Salena Bias,,,"Michelle Dondanville, Jynene Black, Johanna Heron, Cristiane Kaufmann, and Salena Bias.",
Obesity_(Silver_Spring)/PMC3748182.nxml,0.0,Antony Wright,advice;processing;data,DLW,"Antony Wright (MRC Epidemiology Unit, Cambridge) is acknowledged for expert advice on the processing of the DLW data.",acknowledge
Obesity_(Silver_Spring)/PMC3748182.nxml,1.0,Christa Mulder,editing;contribution,,We would also like to thank Christa Mulder for her critical editing contribution.,like;thank
Obesity_(Silver_Spring)/PMC3692602.nxml,0.0,Jason S. Troutt;Robert J. Konrad,employees,Eli Lilly and Company,"Jason S. Troutt and Robert J. Konrad are employees of Eli Lilly and Company, Indianapolis, IN, USA.",
Obesity_(Silver_Spring)/PMC3690173.nxml,0.0,Alan Flint,authors;help;analysis;NHANES;data,School of Public Health;Harvard University;NHANES,"The authors would like to thank Dr Alan Flint (School of Public Health, Harvard University) for his help with the analysis using NHANES data.",like;thank
Obesity_(Silver_Spring)/PMC3732502.nxml,,K. Cianflone,,Canada Research Chair;Adipose Tissue,K. Cianflone holds a Canada Research Chair in Adipose Tissue.,hold
Obesity_(Silver_Spring)/PMC3732502.nxml,0.6688963210702341,James Graham;Elaine Souza;Nicole Mullen,authors;support;nursing;staff;CCRC;nursing;support,CCRC,"The authors thank Marinelle Nuñez, James Graham, and Elaine Souza for their excellent technical support, and Nicole Mullen and the nursing staff at CCRC for their dedicated nursing support.",thank;dedicate
Obesity_(Silver_Spring)/PMC3732502.nxml,1.0,Janet Peerson;Melanie Cianflone,advice;analysis;data;manuscript;preparation,,"We also thank Janet Peerson for expert advice on the statistical analysis of the data, and Melanie Cianflone for manuscript preparation.",thank
Obesity_(Silver_Spring)/PMC3659193.nxml,,Jiancheng Zhuang;Dongju Seo,PhD;assitance;operations;PhD;pictures;study;volunteers;study,Yale University,"We thank Jiancheng Zhuang, PhD for assitance with MRI operations, Dongju Seo, PhD from Yale University for providing the pictures used in this study, and the volunteers who participated in the study.",thank;provide;participate
Obesity_(Silver_Spring)/PMC3763967.nxml,,Alex Chibalin;Juleen Zierath,discussions,,"We are grateful to Lake Jiang, Alex Chibalin and Juleen Zierath for their helpful discussions.",
Obesity_(Silver_Spring)/PMC3731401.nxml,0.2717391304347826,Michael Jensen;Charles Ford;Jaime Gransee;Barbara McCloskey,assistance;deuterium;analyses;assistance;assays,the Mayo Clinic;Thomas Jefferson University,"We thank Dr. Michael Jensen, Charles Ford, and Jaime Gransee at the Mayo Clinic for assistance with the deuterium analyses, and Dr. Barbara McCloskey at Thomas Jefferson University for assistance with the 25(OH)D assays.",thank
Obesity_(Silver_Spring)/PMC3731401.nxml,0.0,Dale Schoeller,input;method,,We also thank Dr. Dale Schoeller for input on the TBW method.,thank
Obesity_(Silver_Spring)/PMC3692609.nxml,0.0,Louis Aronne;Dermot Haughey,advice;participation;data;analysis,NMR,We thank Dr. Louis Aronne for his insightful advice and Dermot Haughey for participation in NMR data analysis.,thank
Obesity_(Silver_Spring)/PMC3778038.nxml,0.49874686716791977,Gary Goldfield;Michael Lowe PhD;Suzanne Phelan PhD;Deborah Tate,authors;individuals;review;PhD;PhD;PhD,WCSS,"The authors wish to thank the following individuals who provided expert review of the WCSS: Gary Goldfield PhD, Michael Lowe PhD, Patrick O’Neil PhD, Suzanne Phelan PhD, and Deborah Tate",wish;thank;follow;provide
Obesity_(Silver_Spring)/PMC3778038.nxml,,Kidney Diseases,content;responsibility;authors;views,the National Institute of Diabetes;Digestive;the National Institutes of Health,The content is solely the responsibility of the authors and does not necessarily represent the official views of the National Institute of Diabetes and Digestive and Kidney Diseases or the National Institutes of Health.,represent
Obesity_(Silver_Spring)/PMC3610816.nxml,0.0,Grant DK078985,Support, Department of Veterans Affairs;National Institute of Diabetes;Digestive;the Minnesota Obesity Center,"Support :  Department of Veterans Affairs, National Institute of Diabetes and Digestive and Kidney diseases Grant DK078985, and the Minnesota Obesity Center.",diseas
Obesity_(Silver_Spring)/PMC3610836.nxml,0.8470948012232415,Scott Bullock;Jessica Montoya;Naaila Panjwani;Monica Solorzano;Jocelyn Topf;Katie VanBuskirk;Rachel Barnes;Robin Masheb,help;project,,"We gratefully acknowledge Scott Bullock, Jessica Montoya, Naaila Panjwani, Monica Solorzano, Jocelyn Topf, Katie VanBuskirk, Rachel Barnes, and Robin Masheb for their help with the project.",acknowledge
Obesity_(Silver_Spring)/PMC4287372.nxml,0.21031746031746032,Richard Granato;Jean Gomez;Roy G. Resendez,support,,"We wish to acknowledge Richard Granato, Irma Jean Gomez, and Roy G. Resendez for excellent technical support.",wish;acknowledge
Obesity_(Silver_Spring)/PMC3465637.nxml,1.0,Guadalupe Compean,assistance,,We would like to thank Ms. Guadalupe Compean for her technical assistance.,like;thank
Obesity_(Silver_Spring)/PMC3484178.nxml,,Siobán Harlow,,PI,"Siobán Harlow, PI 2011 –",
Obesity_(Silver_Spring)/PMC3484178.nxml,0.0,Robert Neer;Howard Kravitz,,"PI;Rush University, Rush University Medical Center","– present; Robert Neer, PI 1994 – 1999; Rush University, Rush University Medical Center, Chicago, IL – Howard Kravitz, PI 2009",
Obesity_(Silver_Spring)/PMC3484178.nxml,1.0,Lynda Powell,,"PI;University of California, Davis/Kaiser – Ellen Gold, PI;University of California","– present; Lynda Powell, PI 1994 – 2009; University of California, Davis/Kaiser – Ellen Gold, PI; University of California, Los Angeles –",
Obesity_(Silver_Spring)/PMC3484178.nxml,1.0,Gail Greendale;Carol Derby,,PI;Albert Einstein College of Medicine;PI,"Gail Greendale, PI; Albert Einstein College of Medicine, Bronx, NY – Carol Derby, PI 2011 –",
Obesity_(Silver_Spring)/PMC3484178.nxml,1.0,Rachel Wildman;Nanette Santoro,,PI;PI;University of Medicine and Dentistry,"present, Rachel Wildman, PI 2010 – 2011; Nanette Santoro, PI 2004 – 2010; University of Medicine and Dentistry –",
Obesity_(Silver_Spring)/PMC3484178.nxml,0.0,Gerson Weiss,,New Jersey Medical School;PI;the University of Pittsburgh,"New Jersey Medical School, Newark – Gerson Weiss, PI 1994 – 2004; and the University of Pittsburgh, Pittsburgh,",
Obesity_(Silver_Spring)/PMC3484178.nxml,1.0,Karen Matthews,,PI,"PA – Karen Matthews, PI .",
Obesity_(Silver_Spring)/PMC3484178.nxml,1.0,Sherry Sherman;Marcia Ory,present,"NIH Program Office;
 National Institute on Aging;National Institute of Nursing Research;MD – Program Officers","NIH Program Office: 
 National Institute on Aging, Bethesda, MD – Sherry Sherman 1994 – present; Marcia Ory 1994 – 2001; National Institute of Nursing Research, Bethesda, MD – Program Officers.",
Obesity_(Silver_Spring)/PMC3484178.nxml,0.0,Daniel McConnell,, (,Daniel McConnell  (Central Ligand Assay Satellite Services).,
Obesity_(Silver_Spring)/PMC3484178.nxml,1.0,Kim Sutton-Tyrrell,,"
 University of Pittsburgh;PA;PI","Coordinating Center: 
 University of Pittsburgh, Pittsburgh, PA – Kim Sutton-Tyrrell, PI 2001",
Obesity_(Silver_Spring)/PMC3484178.nxml,1.0,Sonja McKinlay,,New England Research Institutes;PI,"– present; New England Research Institutes, Watertown, MA - Sonja McKinlay, PI 1995 – 2001.",
Obesity_(Silver_Spring)/PMC3484178.nxml,0.5181347150259067,Susan Johnson;Chris Gallagher,,Steering Committee;Chair,"Steering Committee: Susan Johnson, Current Chair Chris Gallagher, Former Chair 
 ",
Obesity_(Silver_Spring)/PMC3484202.nxml,1.0,Grace Meers,help;assays;students;data;collection,,We would also like to thank Grace Meers for her help with the MPO and PON-1 assays and undergraduate and graduate students that helped with data collection.,like;thank;undergraduate;help
Obesity_(Silver_Spring)/PMC3486953.nxml,0.25,Frances Dancy;Jim Terry AB;Phil Bardsley PhD;Dan Blanchette BA,assistance;PhD;programming;support,BS;UNC,"We thank Ms. Frances Dancy, BS, UNC Carolina Population Center for her helpful administrative assistance, Jim Terry AB, Phil Bardsley PhD, and Dan Blanchette BA for programming and technical support.",thank
Obesity_(Silver_Spring)/PMC3605748.nxml,0.8556998556998557,Elvira Dabaghyan;Hope Thomas;Kisha Harden;Andrew Hill;Kenya Fain;Cynthia Drummond;Shanell Harrison;Sarah Wildrick,assistance;data;collection;management,,"Elvira Dabaghyan, Hope Thomas, Kisha Harden, Andrew Hill, Kenya Fain, Crystal Johnson-Honesty, Cynthia Drummond, Shanell Harrison and Sarah Wildrick provided expert assistance with genotyping or data collection and management.",provide;genotyp
Obesity_(Silver_Spring)/PMC3605748.nxml,,Smari Kristinsson,ehf;software;design;contribution,Larus Arni Hermannsson and Asbjörn Krisbjörnsson of Raförninn,"We would also like to thank Smari Kristinsson, Larus Arni Hermannsson and Asbjörn Krisbjörnsson of Raförninn ehf for their extensive software design and contribution.",like;thank
Obesity_(Silver_Spring)/PMC3484232.nxml,1.0,Pamela Coward;Carrie Wunsch;Jennifer Trautvetter,work;project,,"We would like to thank Pamela Coward, Carrie Wunsch, and Jennifer Trautvetter for their work on this project.",like;thank
Obesity_(Silver_Spring)/PMC3602916.nxml,1.0,Elizabeth Saverino;Eunice Kennedy,,Shriver  National Institute of Child Health and Human Development,We thank Ms. Elizabeth Saverino and the  Eunice Kennedy Shriver  National Institute of Child Health and Human Development,thank
Obesity_(Silver_Spring)/PMC3602310.nxml,0.0,Gary Wand,review;analyses;manuscript,,We thank Dr. Gary Wand for his thoughtful review of our analyses and manuscript.,thank
Obesity_(Silver_Spring)/PMC3630236.nxml,1.0,Faye Riestenberg;Julie Koumoutsos,Members;research;staff;staff;LABS;data;center;staff;contributions,the Surgical Weight Loss Program;Teens,"Members of the clinical research staff, specifically Ms. Faye Riestenberg and Ms. Julie Koumoutsos, the Surgical Weight Loss Program for Teens clinical staff, and the Teen-LABS data coordinating center staff are hereby recognized for their considerable contributions.",coordinate;recognize
Obesity_(Silver_Spring)/PMC3627296.nxml,0.5,Norman Bitterlich;Regina Busch,contributions;assistance;study,,We thank Norman Bitterlich and Regina Busch for their contributions and valuable assistance in this study.,thank
Obesity_(Silver_Spring)/PMC3742665.nxml,1.0,Nancy Davenport-Sis;Amy Hawley,authors;support;researchers;staff;assistance;recruitment;data;collection;data;analysis,the Waisman Center;University of Wisconsin-Madison,"The authors gratefully acknowledge Nancy Davenport-Sis, Amy Hawley, and the support of researchers and staff at the Waisman Center, University of Wisconsin-Madison, for their assistance in recruitment, data collection, and data analysis.",acknowledge
Obesity_(Silver_Spring)/PMC3742678.nxml,0.4962216624685139,Renee Traub-Workman;Donna Foster;Jason P. Yun;G. Esteban Fernandez;Robertson Parkman,authors;expert;animal;handling;assistance;experiments;assistance;microscopy;help;critique;manuscript,Jemily Malvar,"The authors would like to thank Renee Traub-Workman and Donna Foster for expert animal handling, Jason P. Yun for assistance performing experiments, G. Esteban Fernandez for assistance with microscopy, Jemily Malvar for statistical help, and Robertson Parkman for valuable critique of the manuscript.",like;thank;perform
Obesity_(Silver_Spring)/PMC3742692.nxml,1.0,Lora G. Roba;Vida Rostami;Lauren Angelucci;Nicole Gens;Caitlin Hart,Appreciation;data;collection;data;entry;implementation;protocol,Appreciation,"Appreciation is expressed to Lora G. Roba, Vida Rostami, Lauren Angelucci, Nicole Gens and Caitlin Hart for data collection and data entry and assisting in the implementation of protocol.",express;assist
Obesity_(Silver_Spring)/PMC3742694.nxml,0.5938144329896907,Lyndon J. Joseph;Andrew P. Goldberg;Leslie Katzel;Melissa Gray;Gretchen Zietowski,Ph.D.;Ph.D.;nurses;dieticians;research;assistants;assistance;project,"M.D., Ph.D.;Carol St. Clair;Lynda Robey;the Division of Gerontology","We are grateful to Lyndon J. Joseph, Ph.D., Andrew P. Goldberg, M.D., Leslie Katzel, M.D., Ph.D., the nurses, dieticians, research assistants Melissa Gray, Carol St. Clair, Lynda Robey and Gretchen Zietowski, of the Division of Gerontology and GRECC for their assistance to this project.",
Obesity_(Silver_Spring)/PMC3660472.nxml,0.2105263157894737,Nicholas Knuth;Darcy Johannsen;Eric Ravussin;Robert Huizenga,assistance;data;study,,"I thank Nicholas Knuth, Darcy Johannsen, Eric Ravussin, and Robert Huizenga for their assistance in collecting the previously published data used in this study.",thank;collect;publish
Obesity_(Silver_Spring)/PMC4180782.nxml,0.0,Eric Vivier,mice,Centre d’Immunologie de Marseille-Luminy;INSERM,"NKp46-Cre mice provided by Dr. Eric Vivier, Centre d’Immunologie de Marseille-Luminy, Marseille, France, and INSERM, Paris, France.",provide;d’immunologie
Obesity_(Silver_Spring)/PMC3735809.nxml,0.8489666136724959,Hollie Raynor;Steven Hayes;Ami Belmont;Mackenzie Kelly;Vicki Clark;Kimberly Hoffman;Alexandra Nelson;Elizabeth Goetter;Nikki Ryan;Lisa Glassman;Shawn Katterman;Sapna Doshi;Stephanie Brooks,participants;consultants;research;coordinators;group;leaders,,"We would like to thank Mind Your Health participants; consultants Hollie Raynor and Steven Hayes; research coordinators Ami Belmont and Mackenzie Kelly, group leaders Vicki Clark, Kimberly Hoffman, Alexandra Nelson, Elizabeth Goetter, Nikki Ryan, Lisa Glassman, Shawn Katterman, Sapna Doshi and Stephanie Brooks Holliday.",like;thank
Obesity_(Silver_Spring)/PMC3735637.nxml,1.0,Wendy Bennett,study;guarantor;responsibility;work,,Wendy Bennett is the study guarantor and takes full responsibility for the work as a whole.,take
Obesity_(Silver_Spring)/PMC3735638.nxml,0.0,S-J Lee,male;mice,Department of Molecular Biology and Genetics;Johns Hopkins University School of Medicine,"Mst heterozygous male and female mice were obtained from Dr. S-J Lee; Department of Molecular Biology and Genetics, Johns Hopkins University School of Medicine, Baltimore, MD.",obtain
Obesity_(Silver_Spring)/PMC3735638.nxml,0.0,Timothy F Lane,authors;help;isolation;cultures,Department of Ob/Gyn;UCLA;MEF,"The authors acknowledge help from Dr. Timothy F Lane, Department of Ob/Gyn at UCLA in isolation of MEF primary cultures.",acknowledge
Obesity_(Silver_Spring)/PMC3610864.nxml,0.0,David Cox;Raymond Carroll;Kevin Fontaine,assistance,,"We would like to thank Sir David Cox, Raymond Carroll, and Kevin Fontaine for their editorial assistance.",like;thank
Obesity_(Silver_Spring)/PMC3740458.nxml,1.0,Maria Mozzoli;Karen Kresge,assistance;manuscript,BS;BS;Constance Harris Crews,"We thank Maria Mozzoli, BS and Karen Kresge, BS for excellent technical assistance and Constance Harris Crews for typing the manuscript.",thank;type
Obesity_(Silver_Spring)/PMC3752308.nxml,0.5,Claire Margerision-Zilko;Alan Hubbard,authors;contribution;literature;review;PhD;contribution;data;management;consultation,Allison Lindquist;MPH,"The authors also acknowledge Allison Lindquist, MPH for her contribution to the literature review, Claire Margerision-Zilko, PhD for her contribution to data management and Alan Hubbard, Phd for statistical consultation.",acknowledge
Obesity_(Silver_Spring)/PMC3695413.nxml,1.0,Marjorie Treadwell,assistance;ultrasounds,,We thank Dr. Marjorie Treadwell for assistance in obtaining fetal ultrasounds.,thank;obtain
Obesity_(Silver_Spring)/PMC3695413.nxml,0.0,Richard Merkel;Ray Lowery,assistance;data;analyses,,We thank Mr. Richard Merkel and Mr. Ray Lowery for their assistance with data analyses.,thank
Obesity_(Silver_Spring)/PMC3695413.nxml,1.0,Dawn P. Misra,reading;manuscript,,We thank Dr. Dawn P. Misra for critical reading of the manuscript.,thank
Obesity_(Silver_Spring)/PMC4265207.nxml,,Avon Longitudinal Study of Parents,,ALSPAC,Avon Longitudinal Study of Parents and Children (ALSPAC):  ,
Obesity_(Silver_Spring)/PMC4265207.nxml,0.6528384279475983,Pascal Arp;Mila Jhamai;Marijn Verkerk;Lizbeth Herrera;Marjolein Peters,help;managing;QC;database,QC;GWAS,"We thank Pascal Arp, Mila Jhamai, Marijn Verkerk, Lizbeth Herrera and Marjolein Peters for their help in creating, managing and QC of the GWAS database.",thank;create
Obesity_(Silver_Spring)/PMC4265207.nxml,1.0,Karol Estrada;Carolina Medina-Gomez,support;creation;analysis;data,,"Also, we thank Karol Estrada and Carolina Medina-Gomez for their support in creation and analysis of imputed data.",thank
Obesity_(Silver_Spring)/PMC3499683.nxml,0.3333333333333333,Kirsten Granados;Richard Viskochil;Robert Gerber,authors;assistance;discussion,,"The authors would like to thank Kirsten Granados, Richard Viskochil, and Robert Gerber for technical assistance and helpful discussion.",like;thank
Obesity_(Silver_Spring)/PMC3605745.nxml,1.0,Jennifer Timothy;Anne Naupa;June Norman;Eleanor Kleiber;Stephanie Watt,research;assistance,the Vanuatu Ministry of Health;the Vanuatu National Library;Fabien Malclès;the Secretariat of the Pacific Community Library,"We are grateful to Jennifer Timothy of the Vanuatu Ministry of Health, Anne Naupa and June Norman of the Vanuatu National Library, and Eleanor Kleiber, Fabien Malclès, and Stephanie Watt of the Secretariat of the Pacific Community Library in Noumea for invaluable research assistance.",
Obesity_(Silver_Spring)/PMC3630271.nxml,,D. Arterburn,investigator,,Principle investigator: D. Arterburn.,
Obesity_(Silver_Spring)/PMC3630475.nxml,1.0,Judith Borja,mothers;children;Risk,the Infant Care and Risk of Obesity Study Group,We are grateful to all participating mothers and children and to Judith Borja and the Infant Care and Risk of Obesity Study Group.,participate
Obesity_(Silver_Spring)/PMC3630471.nxml,,J. Eisenach;N. Nicholson;D. Schroeder,thanks;support;designing;studies,Mayo Clinic,"Special thanks to Dr. J. Eisenach, Dr. N. Nicholson, and D. Schroeder of Mayo Clinic for support in designing and conducting the studies.",conduct
Obesity_(Silver_Spring)/PMC3630471.nxml,,S. Roberts;J. Knutson;K. Krucker;K. Edens;C. Johnson;N. Strom;H. Tonyan;B. Walker;L. Matzek;B. Kluck;P. Engrav;N. Meyer,assistance;studies;manuscript,Mayo Clinic,"We also thank S. Roberts, J. Knutson, K. Krucker, K. Edens, C. Johnson, N. Strom, H. Tonyan, B. Walker, L. Matzek, B. Kluck, P. Engrav, N. Meyer, and D. Vlazny of Mayo Clinic for their assistance in conducting the studies and/or preparing the manuscript.",thank;conduct;prepare
Obesity_(Silver_Spring)/PMC3630462.nxml,,M. Waring,salary;support,,Partial salary support for M. Waring is provided by 1U01HL105268.,provide
Obesity_(Silver_Spring)/PMC3630476.nxml,0.5967741935483871,Lisa Rafalson;Trang H. Pham;Steven M. Willi;Marsha D. Marcus;Tom Baranowski,writing;group;manuscript,,"The writing group for this manuscript was: Lisa Rafalson, Trang H. Pham, Steven M. Willi, Marsha D. Marcus, Ann Jessup, and Tom Baranowski.",
Obesity_(Silver_Spring)/PMC3630476.nxml,,T. Baranowski;L. Adams;J. Baranowski;K.T. Carter;K.W. Cullen;M.H. Dobbins;R. Jago;A. Oceguera;A.X. Rodriguez;C. Speich;D. Thompson;M.A. White;C.G. Williams; L. Goldberg;D. Cusimano;L. DeBar;D. Elliot;H.M. Grund;S. McCormick;E. Moe;J.B. Roullet,,"F.R. Kaufman; Field Centers 
 Baylor College of Medicine;L.T. Tatum; Oregon Health & Science University;D. Stadler","F.R. Kaufman  Field Centers 
 Baylor College of Medicine:  T. Baranowski*, L. Adams, J. Baranowski, A. Canada, K.T. Carter, K.W. Cullen, M.H. Dobbins, R. Jago, A. Oceguera, A.X. Rodriguez, C. Speich, L.T. Tatum, D. Thompson, M.A. White, C.G. Williams  Oregon Health & Science University:  L. Goldberg*, D. Cusimano, L. DeBar, D. Elliot, H.M. Grund, S. McCormick, E. Moe, J.B. Roullet, D. Stadler  ",
Obesity_(Silver_Spring)/PMC3630476.nxml,,G. Foster,,Temple University,Temple University:  G. Foster,
Obesity_(Silver_Spring)/PMC3630476.nxml,,J. Brown;B. Creighton;M. Faith;E.G. Ford;H. Glick;S. Kumanyika;J. Nachmani;S. Sherman;S. Solomon;S. Volpe;S. Willi;S. Bassin;S. Bruecker;D. Ford;S. Greenfield;J. Hartstein;N. Opgrand;Y. Rodriguez;J. Harrell;A. Anderson;T. Blackshear;J. Caveness;A. Gerstel;C. Giles;P. Kennel;R. McMurray,A.,Steering Committee Chair; University of California at Irvine;M. Schneider  University of North Carolina;Chapel Hill;J. Buse,"* (Steering Committee Chair), J. Brown, B. Creighton, M. Faith, E.G. Ford, H. Glick, S. Kumanyika, J. Nachmani, L. Rosen, S. Sherman, S. Solomon, A. Virus, S. Volpe, S. Willi  University of California at Irvine:  D. Cooper*, S. Bassin, S. Bruecker, D. Ford, P. Galassetti, S. Greenfield, J. Hartstein, M. Krause, N. Opgrand, Y. Rodriguez, M. Schneider  University of North Carolina at Chapel Hill:  J. Harrell*, A. Anderson, T. Blackshear, J. Buse, J. Caveness, A. Gerstel, C. Giles, W. Hall, A. Jessup, P. Kennel, R. McMurray, AAM.",
Obesity_(Silver_Spring)/PMC3630476.nxml,,M. Smith;A. Steckler,,A. Zeveloff  University of Pittsburgh,"SiegaARiz, M. Smith, A. Steckler, A. Zeveloff  University of Pittsburgh:  ",
Obesity_(Silver_Spring)/PMC3630476.nxml,,M. Carter;S. Clayton;B. Gillis;K. Hindes;J. Jakicic;R. Meehan;R. Noll;J. Vanucci;R. Treviño;A. Garcia;A. Hernandez;C. Mobley;J. Stavinoha;Z. Yin;K. Hirst;K. Drews;S. Edelstein;S. Firrell;M. Huang;S. Mazzuto;A. Wheeler;C. Hunter,A.;ghormli,M.D. Marcus;E. Venditti University of Texas Health Science Center;I. Hernandez;Washington University;T. Pham;Project Office  National Institute of Diabetes;Digestive;B. Linder;M. Staten  Central Biochemistry Laboratory  ;University of Washington,"M.D. Marcus*, M. Carter, S. Clayton, B. Gillis, K. Hindes, J. Jakicic, R. Meehan, R. Noll, J. Vanucci, E. Venditti University of Texas Health Science Center at San Antonio: R. Treviño*, A. Garcia, D. Hale, A. Hernandez, I. Hernandez, C. Mobley, T. Murray, J. Stavinoha, K. Surapiboonchai, Z. Yin  Coordinating Center 
 George Washington University:  K. Hirst*, K. Drews, S. Edelstein, L. El ghormli, S. Firrell, M. Huang, P. Kolinjivadi, S. Mazzuto, T. Pham, A. Wheeler  Project Office  National Institute of Diabetes and Digestive and Kidney Diseases: B. Linder*, C. Hunter, M. Staten  Central Biochemistry Laboratory  University of Washington",
Obesity_(Silver_Spring)/PMC3689862.nxml,0.0,Charles E. Rhodes,authors;support;assays,,The authors thank Charles E. Rhodes for technical support with the CRP assays.,thank
Obesity_(Silver_Spring)/PMC3689862.nxml,,Kidney Diseases,co,"the National Institute of Diabetes;Digestive;the National, Heart;Lung and Blood Institute;National Institute of Nursing Research, Office of Research on Women’s Health;National Center on Minority Health;Health Disparities and Centers for Disease Control and Prevention","Look AHEAD is sponsored by the National Institute of Diabetes and Digestive and Kidney Diseases, co-sponsored by the National, Heart, Lung and Blood Institute (NHLBI), National Institute of Nursing Research, Office of Research on Women’s Health, National Center on Minority Health and Health Disparities and Centers for Disease Control and Prevention.",look;sponsor;sponsor
Obesity_(Silver_Spring)/PMC3739931.nxml,0.559322033898305,Holly Maier;Terry Rees,authors;writing;support;programming;support;research;staff;participants;dedication,"Orexigen Therapeutics, Inc.;ARIAD Pharmaceuticals, Inc.;Orexigen Therapeutics, Inc.","The authors thank Holly Maier, PhD (Orexigen Therapeutics, Inc., La Jolla, California; currently affiliated with ARIAD Pharmaceuticals, Inc., Cambridge, Massachusetts, USA) for medical writing support, Terry Rees, Massachusetts, USA (Orexigen Therapeutics, Inc., La Jolla, California, USA) for statistical and programming support, as well as all clinical research staff and participants for their dedication.",thank;affiliate
Obesity_(Silver_Spring)/PMC3855210.nxml,0.5,Susanna Vikman;Mark K. Hechinger,authors;study;participants;families;staff;assistance;genotyping;assistance;assays,The Childhood Obesity Research Center;ALT;AST,"The authors would like to thank the study participants and their families, the staff at The Childhood Obesity Research Center (CORC) at USC, Susanna Vikman for her assistance with genotyping and Mark K. Hechinger for his assistance with the ALT and AST assays.",like;thank
Obesity_(Silver_Spring)/PMC3630243.nxml,0.0,Lean Cuisine,food;weight;maintenance;periods,Weight Watchers Smart,Stouffer’s Lean Cuisine and Weight Watchers Smart Ones kindly provided food used during the weight-maintenance periods.,provide
Obesity_(Silver_Spring)/PMC3630243.nxml,0.25,David Bryan;Robert Petri;Paul Zuckerman;Betty Darnell,assistance;project;coordination;diet;preparation,,We acknowledge David Bryan and Robert Petri for technical assistance; Paul Zuckerman for project coordination; and Betty Darnell for diet preparation.,acknowledge
Obesity_(Silver_Spring)/PMC3695407.nxml,1.0,Connie Murla;Aimee Stewart,thanks;data;management;scientists;staff;data;development,the Pennington Biomedical Research Center;the Pennington Center Longitudinal Study,"Special thanks to Connie Murla and Aimee Stewart for data management, as well as the many clinical scientists and staff of the Pennington Biomedical Research Center who have contributed data to the development of the Pennington Center Longitudinal Study.",contribute
Obesity_(Silver_Spring)/PMC3661693.nxml,1.0,Karen Klein,assistance;preparation;manuscript,,We thank Karen Klein for her editorial assistance in the preparation of this manuscript.,thank
